Incident Number;Incident Types;Reported Date;Nearest Populated Centre;Province;Company;Status;Latitude;Longitude;Approximate Volume Released (mﾳ);Substance;Release Type;Significant;Year;Occurrence Date and Time;Discovered Date and Time;Detailed what happened;What happened category;Detailed why it happened;Why it happened category;Duration of interruption of pipeline operations;Pipeline or Facility Type;Activity being performed at time of incident;How the incident was discovered;Closed Date;Pipeline or facility equipment involved;Rupture;Incident type;Released substance type;Released volume (m3);Pipe body release;Residual effects on the environment;Source of Explosion;Source of Fire;Activity at time of fatality;Number of fatalities;Type of Injury;Number of individuals injured;Workdays lost;Work restricted by injury;Conditions that resulted in the operation beyond  limits;Conditions that resulted in adverse effects on the environment;Number of people evacuated;Regulation;Pipeline Name;Pipeline outside diameter (NPS);Pipeline length (km);Substance carried;Facility Name;Facility Type;Facility latitude;Facility longitude;Country;Affects Company Property;Off Company Property;Affects Pipeline right-of-way;Affects off Pipeline right-of-way;Land Use;Population Density;Kilometre post;Emergency Level;Investigation Type;Was NEB Staff Deployed;Related NEB event number;Equipment or component involved;Design standard;Nominal pipe size;Material;Material grade;Schedule;Design wall thickness (mm);Custom design wall thickness (mm);Actual wall thickness (mm);Licensed maximum operating pressure (kPa);Restricted operating pressure (kPa);Actual operating pressure at time of failure (kPa);Designed depth of cover (m);Actual depth of cover (m);Year of manufacture;Year of installation;Year when put into service;Most recent cathodic protection reading at incident site (mV vs. Cu/CuSO4);Weld type ;Seam type;Seam joining method;Seam clock position;Coating location;Coating type;Coating condition;Application method;Year when the coating was applied;Insulation installed;Repair type;Repair date;Equipment or component has never been inspected;Most recent inspection date for the failed equipment or component;Type of most recent inspection;Most recent inspection part of the routine inspection program;No maintenance done on this equipment or component;Date of the most recent maintenance work for the failed equipment or component;Most recent maintenance Type;Most recent maintenance work part of the routine maintenance program
INC2007-097;Release of Substance;1/2/2008;Grande Prairie;Alberta;Alliance Pipeline Ltd.;Closed;54.84;-118.65;Not Provided;Natural Gas - Sweet;Gas;No;2008;2007/12/27 02:00:00 PM Mountain;2007/12/27 02:00:00 PM Mountain;Damage or deterioration mechanism, Cracking, Corrosion Fatigue;Corrosion and Cracking;Job or system factors, Excessive wear and tear, Improper loading or rate of use;Maintenance;NULL;Transmission;Operation;NULL;7/23/2012;No;No;Release of Substance;Natural Gas - Sweet;0;No;No;NULL;NULL;NULL;NULL;NULL;NULL;NULL;NULL;NULL;NULL;0;OPR;NULL;NULL;NULL;NULL;NULL;NULL;NULL;NULL;Canada;Yes;No;No;No;Unknown Land Use (Historical Data Migration);Unknown Population Density (Historical Data Migration);NULL;Level I;Standard Review;No;NULL;Station/Facility, Compression, Pipe;NULL;NPS 3/4;NULL;NULL;NULL;NULL;NULL;NULL;0;NULL;NULL;NULL;NULL;NULL;NULL;NULL;NULL;NULL;NULL;NULL;NULL;NULL;NULL;NULL;NULL;NULL;No;Replacement;12/27/2007;No;NULL;NULL;No;No;12/27/2007;Replacement;No
INC2008-001;Release of Substance;1/2/2008;Cromer;Manitoba;Enbridge Pipelines Inc.;Closed;49.73135;-101.23557;8;Crude Oil - Sweet;Liquid;No;2008;2008/01/02 11:30:00 AM Central;2008/01/02 11:30:00 AM Central;Damage or deterioration mechanism, Material Loss, Internal Material Loss;Corrosion and Cracking;Job or system factors, Inadequate maintenance, Inadequate preventive, Assessment of needs;Maintenance;NULL;NULL;Operation;Employee / Contractor (Onsite);1/11/2011;Yes;No;Release of Substance;Crude Oil - Sweet;8;No;No;NULL;NULL;NULL;NULL;NULL;NULL;NULL;NULL;NULL;NULL;0;OPR;EPI - Cromer Terminal;NULL;NULL;NULL;NULL;NULL;NULL;NULL;Canada;Yes;No;No;No;Unknown Land Use (Historical Data Migration);Unknown Population Density (Historical Data Migration);NULL;Level I;Standard Review;No;NULL;Station/Facility, Pumping, Flange, Gasket/O-ring;NULL;;NULL;NULL;NULL;NULL;NULL;NULL;NULL;NULL;NULL;NULL;NULL;NULL;NULL;NULL;NULL;NULL;NULL;NULL;NULL;NULL;NULL;NULL;NULL;NULL;No;Type B Sleeve (Pressure Containing);1/11/2008;No;NULL;NULL;No;No;1/11/2008;Repair;No
INC2008-004;Release of Substance;1/23/2008;Cromer;Manitoba;Enbridge Pipelines Inc.;Closed;49.73135;-101.23557;100;Crude Oil - Sweet;Liquid;No;2008;2008/01/23 06:05:00 AM Mountain;2008/01/23 06:05:00 AM Mountain;Damage or deterioration mechanism, Equipment, Gasket/O-ring;Equipment Failure;Job or system factors, Inadequate maintenance, Inadequate reparative, Part substitution;Maintenance;NULL;NULL;Operation;Employee / Contractor (Onsite);8/10/2011;Yes;No;Release of Substance;Crude Oil - Sweet;100;No;No;NULL;NULL;NULL;NULL;NULL;NULL;NULL;NULL;NULL;NULL;0;OPR;EPI - Cromer Terminal;NULL;NULL;NULL;NULL;NULL;NULL;NULL;Canada;Yes;No;No;No;Unknown Land Use (Historical Data Migration);Unknown Population Density (Historical Data Migration);Mile Post 595.8;Level I;Standard Review;No;NULL;Station/Facility, Pumping, Flange, Gasket/O-ring;NULL;NPS 30;NULL;NULL;NULL;NULL;NULL;NULL;0;NULL;NULL;NULL;NULL;NULL;NULL;NULL;NULL;NULL;NULL;NULL;NULL;NULL;NULL;NULL;NULL;NULL;No;Replacement;1/24/2008;No;NULL;NULL;No;No;NULL;Replacement;No
INC2008-008;Release of Substance;1/29/2008;Fort Nelson;British Columbia;Westcoast Energy Inc., carrying on business as Spectra Energy Transmission;Closed;58.012;-122.694333;Not Provided;Natural Gas - Sweet;Gas;No;2008;2008/01/26 10:45:00 AM Pacific;2008/01/26 10:45:00 AM Pacific;Damage or deterioration mechanism, Construction, Defective Other Joint;Defect and Deterioration;Job or system factors, Inadequate maintenance, Inadequate preventive, Lubrication and servicing;Maintenance;NULL;NULL;Operation;Employee / Contractor (Onsite);7/27/2012;Yes;No;Release of Substance;Natural Gas - Sweet;0;No;No;NULL;NULL;NULL;NULL;NULL;NULL;NULL;NULL;NULL;NULL;0;OPR;NULL;NULL;NULL;NULL;NULL;NULL;NULL;NULL;Canada;Yes;No;No;No;Unknown Land Use (Historical Data Migration);Unknown Population Density (Historical Data Migration);NULL;Level I;Standard Review;No;NULL;Station/Facility, Compression, Flange;NULL;;NULL;NULL;NULL;NULL;NULL;NULL;0;NULL;NULL;NULL;1.2;NULL;NULL;NULL;NULL;NULL;NULL;NULL;NULL;NULL;NULL;NULL;NULL;NULL;No;NULL;NULL;No;NULL;NULL;No;No;NULL;NULL;No
INC2008-009;Release of Substance, Adverse Environmental Effects;1/29/2008;Taylor;British Columbia;Westcoast Energy Inc., carrying on business as Spectra Energy Transmission;Closed;56.14377;-120.51605;Not Provided;Potassium Hydroxide (caustic solution);Miscellaneous;No;2008;2008/01/27 12:01:00 AM Mountain;2008/01/27 12:01:00 AM Mountain;Damage or deterioration mechanism, Other Causes, Control System Malfunction;Equipment Failure;"Job or system factors, Inadequate tools and equipment, Inadequate adjustment or repair or maintenance;Job or system factors, Excessive wear and tear, Improper extension of service life;Job or system factors, Inadequate work standards, Inadequate development of standards, Inventory and evaluation of exposures and needs";Maintenance, Standards and Procedures, Tools and Equipment;NULL;NULL;Operation;NULL;11/13/2012;Yes;No;Adverse Environmental Effects, Release of Substance;Potassium Hydroxide (caustic solution);0;No;Yes;NULL;NULL;NULL;NULL;NULL;NULL;NULL;NULL;NULL;NULL;0;PPR;NULL;NULL;NULL;NULL;NULL;NULL;NULL;NULL;Canada;No;No;No;No;Unknown Land Use (Historical Data Migration);Unknown Population Density (Historical Data Migration);NULL;Level I;Standard Review;No;NULL;;NULL;;NULL;NULL;NULL;NULL;NULL;NULL;NULL;NULL;NULL;NULL;NULL;NULL;NULL;NULL;NULL;NULL;NULL;NULL;NULL;NULL;NULL;NULL;NULL;NULL;No;NULL;NULL;No;NULL;NULL;No;No;NULL;NULL;No
INC2008-016;Release of Substance;2/23/2008;Beiseker;Alberta;Foothills Pipe Lines Ltd.;Closed;51.385029;-113.535263;Not Provided;Natural Gas - Sweet;Gas;No;2008;2008/02/22 12:00:00 AM Mountain;2008/02/23 12:00:00 AM Mountain;Damage or deterioration mechanism, Material or Manufacturing, Defective Pipe or Component Body;Defect and Deterioration;Job or system factors, Inadequate maintenance, Inadequate preventive, Assessment of needs;Maintenance;NULL;NULL;Operation;Employee / Contractor (Onsite);7/27/2012;Yes;No;Release of Substance;Natural Gas - Sweet;0;No;No;NULL;NULL;NULL;NULL;NULL;NULL;NULL;NULL;NULL;NULL;0;OPR;NULL;NULL;NULL;NULL;NULL;NULL;NULL;NULL;Canada;No;No;Yes;No;Unknown Land Use (Historical Data Migration);Unknown Population Density (Historical Data Migration);Mainline Valve + Offset (km) MLV 61-121-NC;Level I;Standard Review;No;NULL;Pipeline, Valve, Ball, Bonnet;NULL;NPS 30;NULL;NULL;NULL;NULL;NULL;NULL;0;NULL;NULL;NULL;NULL;NULL;NULL;NULL;NULL;NULL;NULL;NULL;NULL;NULL;NULL;NULL;NULL;NULL;No;Rebuilt;3/25/2008;No;NULL;NULL;No;No;3/25/2008;Repair;No
INC2008-018;Release of Substance;2/25/2008;Moosomin;Saskatchewan;TransCanada PipeLines Limited;Closed;50.20739;-101.48731;100;Natural Gas - Sweet;Gas;No;2008;2008/02/25 12:00:00 AM Mountain;2008/02/25 08:09:00 AM Mountain;Damage or deterioration mechanism, Other Causes, Improper Operation;Incorrect Operation;Job or system factors, Inadequate work standards, Inadequate maintenance of standards, Monitoring use of procedures or practices or rules;Standards and Procedures;NULL;NULL;Construction;Employee / Contractor (Onsite);1/19/2011;Yes;No;Release of Substance;Natural Gas - Sweet;100;No;No;NULL;NULL;NULL;NULL;NULL;NULL;NULL;NULL;NULL;NULL;0;OPR;LINE 100-1;863.60000000, 762.00000000, 508.00000000;2595.724534;Natural Gas;NULL;NULL;NULL;NULL;Canada;Yes;No;No;No;Unknown Land Use (Historical Data Migration);Unknown Population Density (Historical Data Migration);NULL;Level I;Standard Review;No;NULL;Pipeline, Fitting, Tee, Body;NULL;NPS 1/4;NULL;NULL;NULL;NULL;NULL;NULL;0;NULL;NULL;NULL;NULL;NULL;NULL;NULL;NULL;NULL;NULL;NULL;NULL;NULL;NULL;NULL;NULL;NULL;No;NULL;NULL;No;NULL;NULL;No;No;NULL;NULL;No
INC2008-020;Release of Substance;3/3/2008;Dryden;Ontario;TransCanada PipeLines Limited;Closed;49.7894;-92.76549;Not Provided;Natural Gas - Sweet;Gas;No;2008;2008/03/02 10:30:00 AM Eastern;2008/03/02 10:30:00 AM Eastern;Damage or deterioration mechanism, Cracking, Corrosion Fatigue;Corrosion and Cracking;Job or system factors, Excessive wear and tear, Improper loading or rate of use;Maintenance;NULL;NULL;Operation;Employee / Contractor (Onsite);7/27/2012;Yes;No;Release of Substance;Natural Gas - Sweet;0;No;No;NULL;NULL;NULL;NULL;NULL;NULL;NULL;NULL;NULL;NULL;0;OPR;TCPL - Station 55 (Dryden Compressor Station);NULL;NULL;NULL;NULL;NULL;NULL;NULL;Canada;Yes;No;No;No;Unknown Land Use (Historical Data Migration);Unknown Population Density (Historical Data Migration);NULL;Level I;Standard Review;No;NULL;Station/Facility, Compression, Compressor;NULL;;NULL;NULL;NULL;NULL;NULL;NULL;0;NULL;NULL;NULL;NULL;NULL;NULL;NULL;NULL;NULL;NULL;NULL;NULL;NULL;NULL;NULL;NULL;NULL;No;Replacement;3/13/2008;No;NULL;NULL;No;No;3/13/2008;Replacement;No
INC2008-021;Release of Substance;3/3/2008;Smooth Rock Falls;Ontario;TransCanada PipeLines Limited;Closed;49.30391;-82.04386;18;Natural Gas - Sweet;Gas;No;2008;2008/03/01 04:45:00 PM Mountain;2008/03/01 04:45:00 PM Mountain;Damage or deterioration mechanism, Equipment, Valve Seals or Packing;Equipment Failure;Job or system factors, Inadequate maintenance, Inadequate preventive, Assessment of needs;Maintenance;NULL;NULL;Operation;Public;1/19/2011;No;No;Release of Substance;Natural Gas - Sweet;18;No;No;NULL;NULL;NULL;NULL;NULL;NULL;NULL;NULL;NULL;NULL;0;OPR;TCPL - MLV 97;NULL;NULL;NULL;NULL;NULL;NULL;NULL;Canada;No;No;Yes;No;Unknown Land Use (Historical Data Migration);Unknown Population Density (Historical Data Migration);NULL;Level I;Standard Review;No;NULL;;NULL;;NULL;NULL;NULL;NULL;NULL;NULL;NULL;NULL;NULL;NULL;NULL;NULL;NULL;NULL;NULL;NULL;NULL;NULL;NULL;NULL;NULL;NULL;NULL;NULL;No;Replacement;NULL;No;NULL;NULL;No;No;NULL;Replacement;No
INC2008-027;Release of Substance;3/14/2008;Rapid City;Manitoba;TransCanada PipeLines Limited;Closed;50.07673;-99.99864;Not Provided;Natural Gas - Sweet;Gas;No;2008;2008/03/14 01:30:00 PM Central;2008/03/14 01:30:00 PM Central;Damage or deterioration mechanism, Cracking, Corrosion Fatigue;Corrosion and Cracking;Job or system factors, Excessive wear and tear, Improper loading or rate of use;Maintenance;NULL;NULL;Operation;Employee / Contractor (Onsite);7/23/2012;Yes;No;Release of Substance;Natural Gas - Sweet;0;No;No;NULL;NULL;NULL;NULL;NULL;NULL;NULL;NULL;NULL;NULL;0;OPR;MLV 30-4;NULL;NULL;NULL;NULL;NULL;NULL;NULL;Canada;Yes;No;No;No;Unknown Land Use (Historical Data Migration);Unknown Population Density (Historical Data Migration);Mainline Valve + Offset (km) 30-4;Level I;Standard Review;No;NULL;"Pipeline, Pipe, Body;Station/Facility, Compression, Piping, Weld";NULL;NPS 2;NULL;NULL;NULL;NULL;NULL;NULL;0;NULL;NULL;NULL;NULL;NULL;NULL;NULL;NULL;NULL;NULL;NULL;NULL;NULL;NULL;NULL;NULL;NULL;No;Replacement;NULL;No;NULL;NULL;No;No;NULL;Replacement;No
INC2008-030;Fatality;3/24/2008;Kerrobert;Saskatchewan;Enbridge Pipelines Inc.;Closed;51.92095;-109.17023;Not Applicable;Not Applicable;Not Applicable;Yes;2008;2008/03/24 09:50:00 AM Mountain;2008/03/24 09:50:00 AM Mountain;"Substandard Acts, Failing to use PPE properly;Substandard Acts, Improper position for task;Substandard Acts, Failure to follow procedure or policy or practice;Substandard Conditions, Inadequate guards or barriers;Substandard Conditions, Inadequate warning system";External Interference, Incorrect Operation;Job or system factors, Inadequate leadership and/or supervision, Inadequate instructions, orientation and/or training;Inadequate Supervision;NULL;Transmission;Maintenance;Employee / Contractor (Onsite);12/15/2010;No;No;Fatality;NULL;NULL;NULL;No;NULL;NULL;Construction;1;NULL;NULL;NULL;NULL;NULL;NULL;0;OPR;Line 4;1219.00000000, 914.00000000, 864.00000000;1248.909872;Crude Oil;NULL;NULL;NULL;NULL;Canada;Yes;No;No;No;Unknown Land Use (Historical Data Migration);Unknown Population Density (Historical Data Migration);NULL;Level I;Standard Review;No;NULL;;NULL;;NULL;NULL;NULL;NULL;NULL;NULL;NULL;NULL;NULL;NULL;NULL;NULL;NULL;NULL;NULL;NULL;NULL;NULL;NULL;NULL;NULL;NULL;NULL;NULL;No;NULL;NULL;No;NULL;NULL;No;No;NULL;NULL;No
INC2008-034;Release of Substance;4/1/2008;Haileybury;Ontario;TransCanada PipeLines Limited;Closed;47.44678;-79.76267;Not Provided;Natural Gas - Sweet;Gas;No;2008;NULL;2008/03/31 01:17:00 AM Mountain;Damage or deterioration mechanism, Cracking, Fatigue;Corrosion and Cracking;Job or system factors, Inadequate engineering, Inadequate monitoring of construction;Engineering and Planning;NULL;Transmission;Construction;NULL;7/23/2012;No;No;Release of Substance;Natural Gas - Sweet;0;No;No;NULL;NULL;NULL;NULL;NULL;NULL;NULL;NULL;NULL;NULL;0;OPR;LINE 100-1;863.60000000, 762.00000000, 508.00000000;2595.724534;Natural Gas;NULL;NULL;NULL;NULL;Canada;No;No;No;No;Unknown Land Use (Historical Data Migration);Unknown Population Density (Historical Data Migration);NULL;Level I;Standard Review;No;NULL;Station/Facility, Compression, Fitting, Other (please explain);NULL;NPS 1;NULL;NULL;NULL;NULL;NULL;NULL;0;NULL;NULL;NULL;NULL;NULL;NULL;NULL;NULL;NULL;NULL;NULL;NULL;NULL;NULL;NULL;NULL;NULL;No;Replacement;9/21/2008;No;NULL;NULL;No;No;9/21/2008;Replacement;No
INC2008-037;Release of Substance;4/18/2008;Kenora;Ontario;TransCanada PipeLines Limited;Closed;49.80823;-94.18954;Not Provided;Natural Gas - Sweet;Gas;No;2008;2008/04/16 02:30:00 PM Eastern;2008/04/16 02:30:00 PM Eastern;Damage or deterioration mechanism, Construction, Defective Pipe or Component Body;Defect and Deterioration;"Job or system factors, Inadequate tools and equipment, Inadequate adjustment or repair or maintenance;Personal factors, Abuse or misuse, Improper conduct that is not condoned, Unintentional";Human Factors, Tools and Equipment;NULL;NULL;Maintenance;Employee / Contractor (Onsite);7/27/2012;Yes;No;Release of Substance;Natural Gas - Sweet;0;No;No;NULL;NULL;NULL;NULL;NULL;NULL;NULL;NULL;NULL;NULL;0;OPR;NULL;NULL;NULL;NULL;NULL;NULL;NULL;NULL;Canada;Yes;No;No;No;Unknown Land Use (Historical Data Migration);Unknown Population Density (Historical Data Migration);Mainline Valve + Offset (km) 50-2;Level I;Standard Review;No;NULL;Pipeline, Fitting, Nipple, Thread;NULL;;NULL;NULL;NULL;NULL;NULL;NULL;NULL;NULL;NULL;NULL;NULL;NULL;NULL;NULL;NULL;NULL;NULL;NULL;NULL;NULL;NULL;NULL;NULL;NULL;No;Replacement;NULL;No;NULL;NULL;No;No;NULL;Replacement;No
INC2008-039;Release of Substance;4/21/2008;Regina;Saskatchewan;Plains Marketing Canada, L.P.;Closed;50.48057;-104.56646;4;Crude Oil - Sweet;Liquid;No;2008;2008/04/21 07:00:00 AM Mountain;2008/04/21 07:00:00 AM Mountain;Damage or deterioration mechanism, Equipment, Valve Seals or Packing;Equipment Failure;Job or system factors, Inadequate maintenance, Inadequate reparative, Part substitution;Maintenance;NULL;NULL;Operation;Employee / Contractor (Onsite);7/23/2012;Yes;No;Release of Substance;Crude Oil - Sweet;4;No;No;NULL;NULL;NULL;NULL;NULL;NULL;NULL;NULL;NULL;NULL;0;OPR;NULL;NULL;NULL;NULL;NULL;NULL;NULL;NULL;Canada;Yes;No;No;No;Unknown Land Use (Historical Data Migration);Unknown Population Density (Historical Data Migration);Legal Subdivision NW-33-17-19 W2;Level I;Standard Review;No;NULL;;NULL;;NULL;NULL;NULL;NULL;NULL;NULL;NULL;NULL;NULL;NULL;NULL;NULL;NULL;NULL;NULL;NULL;NULL;NULL;NULL;NULL;NULL;NULL;NULL;NULL;No;NULL;NULL;No;NULL;NULL;No;No;NULL;NULL;No
INC2008-040;Release of Substance;4/25/2008;Charlie Lake;British Columbia;Westcoast Energy Inc., carrying on business as Spectra Energy Transmission;Closed;56.27973;-120.96341;Not Provided;Natural Gas - Sour;Gas;No;2008;2008/04/24 07:00:00 PM Pacific;2008/04/24 07:00:00 PM Pacific;Damage or deterioration mechanism, Construction, Defective Other Joint;Defect and Deterioration;"Personal factors, Lack of knowledge, Lack of experience;Job or system factors, Inadequate communications, Inadequate communication methods ";Failure in communication, Human Factors;NULL;NULL;Operation;Employee / Contractor (Onsite);1/19/2011;Yes;No;Release of Substance;Natural Gas - Sour;0;No;No;NULL;NULL;NULL;NULL;NULL;NULL;NULL;NULL;NULL;NULL;0;OPR;NULL;NULL;NULL;NULL;NULL;NULL;NULL;NULL;Canada;Yes;No;No;No;Unknown Land Use (Historical Data Migration);Unknown Population Density (Historical Data Migration);Kilometer Post 24.5;Level I;Standard Review;No;NULL;Pipeline, Fitting, Nipple, Body;NULL;;NULL;NULL;NULL;NULL;NULL;NULL;NULL;NULL;NULL;NULL;NULL;NULL;NULL;NULL;NULL;NULL;NULL;NULL;NULL;NULL;NULL;NULL;NULL;NULL;No;Replacement;4/24/2008;No;NULL;NULL;No;No;4/24/2008;Replacement;No
INC2008-041;Release of Substance;4/25/2008;Chetwynd;British Columbia;Westcoast Energy Inc., carrying on business as Spectra Energy Transmission;Closed;55.33867;-121.87115;Not Provided;Natural Gas - Sour;Gas;No;2008;2008/04/15 12:00:00 PM Pacific;2008/04/15 12:00:00 PM Pacific;Damage or deterioration mechanism, Equipment, Valve Seals or Packing;Equipment Failure;Job or system factors, Inadequate maintenance, Inadequate reparative, Part substitution;Maintenance;NULL;NULL;Maintenance;Employee / Contractor (Onsite);8/15/2012;Yes;No;Release of Substance;Natural Gas - Sour;0;No;No;NULL;NULL;NULL;NULL;NULL;NULL;NULL;NULL;NULL;NULL;0;OPR;NULL;NULL;NULL;NULL;NULL;NULL;NULL;NULL;Canada;No;No;Yes;No;Unknown Land Use (Historical Data Migration);Unknown Population Density (Historical Data Migration);Kilometer Post 12;Level I;Standard Review;No;NULL;Pipeline, Valve, Ball, Other (please explain);NULL;;NULL;NULL;NULL;NULL;NULL;NULL;NULL;NULL;NULL;NULL;NULL;NULL;NULL;NULL;NULL;NULL;NULL;NULL;NULL;NULL;NULL;NULL;NULL;NULL;No;Replacement;NULL;No;NULL;NULL;No;No;NULL;Replacement;No
INC2008-043;Fire;5/1/2008;Cromer;Manitoba;Enbridge Pipelines Inc.;Closed;49.73115;-101.2355;Not Applicable;Not Applicable;Not Applicable;No;2008;2008/05/01 02:00:00 PM Mountain;2008/05/01 02:00:00 PM Mountain;Substandard Conditions, Fire and explosion hazards;External Interference;Job or system factors, Inadequate maintenance, Inadequate preventive, Assessment of needs;Maintenance;NULL;NULL;Maintenance;Employee / Contractor (Onsite);7/23/2012;No;No;Fire;NULL;NULL;NULL;No;NULL;Equipment & Electrical;NULL;NULL;NULL;NULL;NULL;NULL;NULL;NULL;0;OPR;EPI - Cromer Terminal;NULL;NULL;NULL;NULL;NULL;NULL;NULL;Canada;Yes;No;No;No;Unknown Land Use (Historical Data Migration);Unknown Population Density (Historical Data Migration);Mile Post 595.8;Level I;Standard Review;No;NULL;;NULL;;NULL;NULL;NULL;NULL;NULL;NULL;NULL;NULL;NULL;NULL;NULL;NULL;NULL;NULL;NULL;NULL;NULL;NULL;NULL;NULL;NULL;NULL;NULL;NULL;No;NULL;NULL;No;NULL;NULL;No;No;NULL;NULL;No
INC2008-045;Release of Substance;5/6/2008;Herschel;Saskatchewan;Enbridge Pipelines Inc.;Closed;51.63826;-108.3544;9.4;Crude Oil - Sweet;Liquid;No;2008;2008/05/06 11:45:00 AM Mountain;2008/05/06 11:45:00 AM Mountain;Damage or deterioration mechanism, Construction, Defective Pipe or Component Body;Defect and Deterioration;Job or system factors, Inadequate work standards, Inadequate maintenance of standards, Monitoring use of procedures or practices or rules;Standards and Procedures;NULL;NULL;Operation;Employee / Contractor (Onsite);7/23/2012;Yes;No;Release of Substance;Crude Oil - Sweet;9.4;No;No;NULL;NULL;NULL;NULL;NULL;NULL;NULL;NULL;NULL;NULL;0;OPR;EPI - Herschel Pump Station;NULL;NULL;NULL;NULL;NULL;NULL;NULL;Canada;Yes;No;No;No;Unknown Land Use (Historical Data Migration);Unknown Population Density (Historical Data Migration);Mile Post 257;Level I;Standard Review;No;NULL;Station/Facility, Pumping, Piping;NULL;NPS 3/4;NULL;NULL;NULL;NULL;NULL;NULL;0;NULL;NULL;NULL;NULL;NULL;NULL;NULL;NULL;NULL;NULL;NULL;NULL;NULL;NULL;NULL;NULL;NULL;No;Replacement;NULL;No;NULL;NULL;No;No;NULL;Replacement;No
INC2008-048;Release of Substance;5/12/2008;Regina;Saskatchewan;Enbridge Pipelines Inc.;Closed;50.48386;-104.61447;7;Crude Oil - Sweet;Liquid;No;2008;2008/05/11 11:30:00 PM Mountain;2008/05/11 11:30:00 PM Mountain;Damage or deterioration mechanism, Equipment, Valve Seals or Packing;Equipment Failure;"Job or system factors, Inadequate engineering, Inadequate standards, specifications and/or design criteria;Job or system factors, Inadequate maintenance, Inadequate preventive, Assessment of needs";Engineering and Planning, Maintenance;NULL;NULL;Operation;Employee / Contractor (Onsite);8/10/2011;Yes;No;Release of Substance;Crude Oil - Sweet;7;No;No;NULL;NULL;NULL;NULL;NULL;NULL;NULL;NULL;NULL;NULL;0;OPR;EPI - Regina Terminal;NULL;NULL;NULL;NULL;NULL;NULL;NULL;Canada;Yes;No;No;No;Unknown Land Use (Historical Data Migration);Unknown Population Density (Historical Data Migration);NULL;Level I;Standard Review;No;NULL;Station/Facility, Metering, Receiving, Valve, Pressure relief, Other (please explain);NULL;;NULL;NULL;NULL;NULL;NULL;NULL;NULL;NULL;NULL;NULL;NULL;NULL;NULL;NULL;NULL;NULL;NULL;NULL;NULL;NULL;NULL;NULL;NULL;NULL;No;Replacement;5/12/2008;No;NULL;NULL;No;No;5/12/2008;Replacement;No
INC2008-052;Fire;5/21/2008;Emerson;Manitoba;TransCanada PipeLines Limited;Closed;49.00106;-97.05547;Not Applicable;Not Applicable;Not Applicable;No;2008;2008/05/18 01:35:00 PM Mountain;2008/05/18 01:35:00 PM Mountain;Damage or deterioration mechanism, Other Causes, Control System Malfunction;Equipment Failure;Job or system factors, Inadequate maintenance, Inadequate preventive, Assessment of needs;Maintenance;NULL;NULL;Operation;Employee / Contractor (Onsite);3/27/2009;Yes;No;Fire;NULL;NULL;NULL;No;NULL;Under Investigation or Unknown;NULL;NULL;NULL;NULL;NULL;NULL;NULL;NULL;0;OPR;NULL;NULL;NULL;NULL;NULL;NULL;NULL;NULL;Canada;Yes;No;No;No;Unknown Land Use (Historical Data Migration);Unknown Population Density (Historical Data Migration);Mainline Valve + Offset (km);Level I;Standard Review;No;NULL;Station/Facility, Compression, Auxiliary power unit;NULL;;NULL;NULL;NULL;NULL;NULL;NULL;0;NULL;NULL;NULL;NULL;NULL;NULL;NULL;NULL;NULL;NULL;NULL;NULL;NULL;NULL;NULL;NULL;NULL;No;Replacement;NULL;No;NULL;NULL;No;No;NULL;Replacement;No
INC2008-055;Adverse Environmental Effects;5/31/2008;Fort St. John;British Columbia;Westcoast Energy Inc., carrying on business as Spectra Energy Transmission;Closed;56.47564;-120.37265;Not Applicable;Not Applicable;Not Applicable;No;2008;2008/05/31 01:15:00 PM Mountain;2008/05/31 01:15:00 PM Mountain;Damage or deterioration mechanism, Equipment, Valve Seals or Packing;Equipment Failure;Job or system factors, Excessive wear and tear, Inadequate inspection and/or monitoring;Maintenance;NULL;NULL;Operation;3rd Party / Other Company;11/13/2012;No;No;Adverse Environmental Effects;NULL;NULL;NULL;No;NULL;NULL;NULL;NULL;NULL;NULL;NULL;NULL;NULL;Release of Toxic Substance;0;OPR;N/A;NULL;NULL;NULL;NULL;NULL;NULL;NULL;Canada;Yes;Yes;No;No;Unknown Land Use (Historical Data Migration);10 or fewer dwelling units per km;Kilometer Post;Level I;Standard Review;No;NULL;;NULL;;NULL;NULL;NULL;NULL;NULL;NULL;NULL;NULL;NULL;NULL;NULL;NULL;NULL;NULL;NULL;NULL;NULL;NULL;NULL;NULL;NULL;NULL;NULL;NULL;No;NULL;NULL;No;NULL;NULL;No;No;NULL;NULL;No
INC2008-056;Release of Substance;6/5/2008;Edmonton;Alberta;Enbridge Pipelines Inc.;Closed;53.5431;-113.35401;8;Crude Oil - Sweet;Liquid;No;2008;2008/06/05 07:20:00 PM Mountain;2008/06/05 07:20:00 PM Mountain;Damage or deterioration mechanism, Equipment, Valve Seals or Packing;Equipment Failure;Job or system factors, Excessive wear and tear, Improper extension of service life;Maintenance;NULL;NULL;Operation;Employee / Contractor (Onsite);7/23/2012;Yes;No;Release of Substance;Crude Oil - Sweet;8;No;No;NULL;NULL;NULL;NULL;NULL;NULL;NULL;NULL;NULL;NULL;0;OPR;EPI - Edmonton Terminal;NULL;NULL;NULL;NULL;NULL;NULL;NULL;Canada;Yes;No;No;No;Unknown Land Use (Historical Data Migration);10 or fewer dwelling units per km;Mile Post 0;Level I;Standard Review;No;NULL;Storage, Tank, Aboveground;NULL;;NULL;NULL;NULL;NULL;NULL;NULL;NULL;NULL;NULL;NULL;NULL;NULL;NULL;NULL;NULL;NULL;NULL;NULL;NULL;NULL;NULL;NULL;NULL;NULL;No;Removal;6/5/2008;No;NULL;NULL;No;No;6/5/2008;Repair;No
INC2008-057;Release of Substance;6/6/2008;Maple;Ontario;TransCanada PipeLines Limited;Closed;43.87378;-79.57985;270;Natural Gas - Sweet;Gas;No;2008;2008/06/06 11:23:00 AM Eastern;2008/06/06 11:23:00 AM Eastern;Damage or deterioration mechanism, Cracking, Corrosion Fatigue;Corrosion and Cracking;Job or system factors, Inadequate work standards, Inadequate development of standards, Procedures or practices or rules;Standards and Procedures;NULL;NULL;Operation;Employee / Contractor (Onsite);7/23/2012;Yes;No;Release of Substance;Natural Gas - Sweet;270;No;No;NULL;NULL;NULL;NULL;NULL;NULL;NULL;NULL;NULL;NULL;0;OPR;TCPL - Station 130 (Maple Compressor Station);NULL;NULL;NULL;NULL;NULL;NULL;NULL;Canada;Yes;No;No;No;Unknown Land Use (Historical Data Migration);10 or fewer dwelling units per km;Kilometer Post;Level I;Standard Review;No;NULL;;NULL;;NULL;NULL;NULL;NULL;NULL;NULL;NULL;NULL;NULL;NULL;NULL;NULL;NULL;NULL;NULL;NULL;NULL;NULL;NULL;NULL;NULL;NULL;NULL;NULL;No;NULL;NULL;No;NULL;NULL;No;No;NULL;NULL;No
INC2008-058;Adverse Environmental Effects;6/9/2008;Not specified;New Brunswick;Emera Brunswick Pipeline Company Ltd.;Closed;45.21594;-66.71029;Not Applicable;Not Applicable;Not Applicable;No;2008;2008/06/09 03:20:00 PM Atlantic;2008/06/09 03:20:00 PM Atlantic;Damage or deterioration mechanism, Equipment, Valve Seals or Packing;Equipment Failure;Job or system factors, Excessive wear and tear, Inadequate inspection and/or monitoring;Maintenance;NULL;NULL;Construction;Employee / Contractor (Onsite);7/27/2012;Yes;No;Adverse Environmental Effects;NULL;NULL;NULL;No;NULL;NULL;NULL;NULL;NULL;NULL;NULL;NULL;NULL;NULL;0;OPR;NULL;NULL;NULL;NULL;NULL;NULL;NULL;NULL;Canada;No;No;No;Yes;Unknown Land Use (Historical Data Migration);Unknown Population Density (Historical Data Migration);Kilometer Post 141+765;Level I;Standard Review;No;NULL;Vehicle / mobile equipment;NULL;;NULL;NULL;NULL;NULL;NULL;NULL;NULL;NULL;NULL;NULL;NULL;NULL;NULL;NULL;NULL;NULL;NULL;NULL;NULL;NULL;NULL;NULL;NULL;NULL;No;NULL;NULL;No;NULL;NULL;No;No;NULL;NULL;No
INC2008-060;Release of Substance;6/12/2008;Portage La Prairie;Manitoba;TransCanada PipeLines Limited;Closed;49.91204;-98.51757;Not Provided;Natural Gas - Sweet;Gas;No;2008;2008/06/12 12:00:00 AM Mountain;2008/06/12 05:20:00 AM Central;Damage or deterioration mechanism, Equipment, Valve Seals or Packing;Equipment Failure;Job or system factors, Excessive wear and tear, Inadequate maintenance;Maintenance;NULL;NULL;Operation;Public;7/15/2015;Yes;No;Release of Substance;Natural Gas - Sweet;0;No;No;NULL;NULL;NULL;NULL;NULL;NULL;NULL;NULL;NULL;NULL;0;OPR;NULL;NULL;NULL;NULL;NULL;NULL;NULL;NULL;Canada;Yes;No;No;No;Unknown Land Use (Historical Data Migration);Unknown Population Density (Historical Data Migration);NULL;Level I;Standard Review;No;NULL;Station/Facility, Compression, Valve, Pressure relief, Other (please explain);NULL;;NULL;NULL;NULL;NULL;NULL;NULL;NULL;NULL;NULL;NULL;NULL;NULL;NULL;NULL;NULL;NULL;NULL;NULL;NULL;NULL;NULL;NULL;NULL;NULL;No;Rebuilt;6/12/2008;No;NULL;NULL;No;No;6/12/2008;Repair;No
INC2008-062;Fire;6/24/2008;Moyie;British Columbia;TransCanada PipeLines Limited;Closed;49.28795;-115.83383;Not Applicable;Not Applicable;Not Applicable;No;2008;2008/06/23 08:06:00 PM Pacific;2008/06/23 08:06:00 PM Pacific;Substandard Conditions, Fire and explosion hazards;External Interference;Job or system factors, Inadequate work standards, Inadequate maintenance of standards, Monitoring use of procedures or practices or rules;Standards and Procedures;NULL;NULL;Operation;Employee / Contractor (Onsite);7/27/2012;Yes;No;Fire;NULL;NULL;NULL;No;NULL;Equipment & Electrical;NULL;NULL;NULL;NULL;NULL;NULL;NULL;NULL;0;OPR;TCPL, BC - Station 2B (Moyie Compressor Station);NULL;NULL;NULL;NULL;NULL;NULL;NULL;Canada;Yes;No;No;No;Unknown Land Use (Historical Data Migration);Unknown Population Density (Historical Data Migration);NULL;Level I;Standard Review;No;NULL;Station/Facility, Compression, Compressor;NULL;;NULL;NULL;NULL;NULL;NULL;NULL;NULL;NULL;NULL;NULL;NULL;NULL;NULL;NULL;NULL;NULL;NULL;NULL;NULL;NULL;NULL;NULL;NULL;NULL;No;Replacement;NULL;No;NULL;NULL;No;No;NULL;Replacement;No
INC2008-063;Fatality;6/25/2008;Herschel;Saskatchewan;Enbridge Pipelines Inc.;Closed;51.63833;-108.35487;Not Applicable;Not Applicable;Not Applicable;Yes;2008;2008/06/24 04:30:00 PM Mountain;2008/06/24 04:30:00 PM Mountain;"Substandard Acts, Failure to secure;Substandard Acts, Failing to use PPE properly;Substandard Acts, Failure to follow procedure or policy or practice";Incorrect Operation;"Personal factors, Improper motivation, Improper attempt to save time or effort;Job or system factors, Inadequate leadership and/or supervision, Inadequate instructions, orientation and/or training;Job or system factors, Inadequate work standards, Inadequate maintenance of standards, Monitoring use of procedures or practices or rules";Human Factors, Inadequate Supervision, Standards and Procedures;NULL;NULL;Construction;Employee / Contractor (Onsite);12/15/2010;No;No;Fatality;NULL;NULL;NULL;No;NULL;NULL;Vehicle Accident;1;NULL;NULL;NULL;NULL;NULL;NULL;0;OPR;Hershel Sask;NULL;NULL;NULL;NULL;NULL;NULL;NULL;Canada;No;Yes;No;Yes;Unknown Land Use (Historical Data Migration);Unknown Population Density (Historical Data Migration);NULL;Level III;Category C;No;NULL;;NULL;;NULL;NULL;NULL;NULL;NULL;NULL;NULL;NULL;NULL;NULL;NULL;NULL;NULL;NULL;NULL;NULL;NULL;NULL;NULL;NULL;NULL;NULL;NULL;NULL;No;NULL;NULL;No;NULL;NULL;No;No;NULL;NULL;No
INC2008-067;Release of Substance;7/6/2008;Edmonton;Alberta;Enbridge Pipelines Inc.;Closed;53.54745;-113.35577;40;Crude Oil - Synthetic;Liquid;No;2008;2008/07/06 12:00:00 AM Mountain;2008/07/06 09:00:00 AM Mountain;Substandard Acts, Failure to warn;Incorrect Operation;Job or system factors, Excessive wear and tear, Improper loading or rate of use;Maintenance;NULL;NULL;Operation;Employee / Contractor (Onsite);7/27/2012;Yes;No;Release of Substance;Crude Oil - Synthetic;40;No;No;NULL;NULL;NULL;NULL;NULL;NULL;NULL;NULL;NULL;NULL;0;OPR;Edmonton Terminal;NULL;NULL;NULL;NULL;NULL;NULL;NULL;Canada;Yes;No;No;No;Unknown Land Use (Historical Data Migration);Unknown Population Density (Historical Data Migration);NULL;Level I;Standard Review;No;NULL;Storage, Tank, Aboveground;NULL;;NULL;NULL;NULL;NULL;NULL;NULL;NULL;NULL;NULL;NULL;NULL;NULL;NULL;NULL;NULL;NULL;NULL;NULL;NULL;NULL;NULL;NULL;NULL;NULL;No;Removal;NULL;No;NULL;NULL;No;No;NULL;Repair;No
INC2008-070;Release of Substance;7/17/2008;Moosomin;Saskatchewan;TransCanada PipeLines Limited;Closed;50.20731;-101.48747;Not Provided;Natural Gas - Sweet;Gas;No;2008;2008/07/16 12:00:00 AM Mountain;2008/07/16 09:40:00 AM Mountain;Damage or deterioration mechanism, Construction, Defective Pipe or Component Body;Defect and Deterioration;Personal factors, Abuse or misuse, Improper conduct that is condoned, Intentional;Human Factors;NULL;NULL;Operation;Employee / Contractor (Onsite);7/23/2012;Yes;No;Release of Substance;Natural Gas - Sweet;0;No;No;NULL;NULL;NULL;NULL;NULL;NULL;NULL;NULL;NULL;NULL;0;OPR;TCPL - Station 25 (Moosomin Compressor Station);NULL;NULL;NULL;NULL;NULL;NULL;NULL;Canada;Yes;No;No;No;Unknown Land Use (Historical Data Migration);Unknown Population Density (Historical Data Migration);NULL;Level I;Standard Review;No;NULL;Station/Facility, Compression, Compressor;NULL;NPS 3/8;Carbon Steel;NULL;NULL;NULL;NULL;NULL;0;NULL;NULL;NULL;0;NULL;NULL;NULL;NULL;NULL;NULL;NULL;NULL;NULL;NULL;NULL;NULL;NULL;No;Replacement;7/16/2008;No;NULL;NULL;No;No;7/16/2008;Replacement;No
INC2008-072;Release of Substance;7/18/2008;Alameda;Saskatchewan;Alliance Pipeline Ltd.;Closed;49.31834;-102.28983;800;Natural Gas - Sweet;Gas;No;2008;2008/07/09 12:00:00 AM Mountain;2008/07/09 03:30:00 PM Mountain;Damage or deterioration mechanism, Equipment, Valve Seals or Packing;Equipment Failure;Job or system factors, Inadequate maintenance, Inadequate preventive, Adjustment or assembly;Maintenance;NULL;NULL;Operation;Employee / Contractor (Onsite);7/15/2015;Yes;No;Release of Substance;Natural Gas - Sweet;800;No;No;NULL;NULL;NULL;NULL;NULL;NULL;NULL;NULL;NULL;NULL;0;OPR;Alliance - Alameda Compressor Station;NULL;NULL;NULL;NULL;NULL;NULL;NULL;Canada;Yes;No;No;No;Unknown Land Use (Historical Data Migration);Unknown Population Density (Historical Data Migration);NULL;Level I;Standard Review;No;NULL;Station/Facility, Compression, Valve;NULL;;NULL;NULL;NULL;NULL;NULL;NULL;NULL;NULL;NULL;NULL;NULL;NULL;NULL;NULL;NULL;NULL;NULL;NULL;NULL;NULL;NULL;NULL;NULL;NULL;No;Rebuilt;7/9/2008;No;NULL;NULL;No;No;7/9/2008;Repair;No
INC2008-075;Release of Substance;7/23/2008;Edmonton;Alberta;Enbridge Pipelines Inc.;Closed;53.5416;-113.36454;2;Diesel Fuel;Liquid;No;2008;2008/07/23 08:30:00 AM Mountain;2008/07/23 08:30:00 AM Mountain;Damage or deterioration mechanism, Other Causes, Control System Malfunction;Equipment Failure;Job or system factors, Inadequate work standards, Inadequate maintenance of standards, Monitoring use of procedures or practices or rules;Standards and Procedures;NULL;NULL;Operation;Employee / Contractor (Onsite);8/1/2012;Yes;No;Release of Substance;Diesel Fuel;2;No;No;NULL;NULL;NULL;NULL;NULL;NULL;NULL;NULL;NULL;NULL;0;OPR;EPI - Edmonton Terminal;NULL;NULL;NULL;NULL;NULL;NULL;NULL;Canada;Yes;No;No;No;Unknown Land Use (Historical Data Migration);Unknown Population Density (Historical Data Migration);NULL;Level I;Standard Review;No;NULL;Storage, Tank, Aboveground;NULL;;NULL;NULL;NULL;NULL;NULL;NULL;NULL;NULL;NULL;NULL;NULL;NULL;NULL;NULL;NULL;NULL;NULL;NULL;NULL;NULL;NULL;NULL;NULL;NULL;No;Replacement;8/12/2008;No;NULL;NULL;No;No;8/12/2008;Replacement;No
INC2008-078;Release of Substance;7/31/2008;Hearst;Ontario;TransCanada PipeLines Limited;Closed;49.79469;-85.85655;Not Provided;Natural Gas - Sweet;Gas;No;2008;2008/07/29 11:00:00 AM Mountain;2008/07/29 11:00:00 AM Mountain;Damage or deterioration mechanism, Construction, Defective Other Joint;Defect and Deterioration;Job or system factors, Inadequate maintenance, Inadequate preventive, Assessment of needs;Maintenance;NULL;NULL;Operation;Employee / Contractor (Onsite);7/27/2012;Yes;No;Release of Substance;Natural Gas - Sweet;0;No;No;NULL;NULL;NULL;NULL;NULL;NULL;NULL;NULL;NULL;NULL;0;OPR;NULL;NULL;NULL;NULL;NULL;NULL;NULL;NULL;Canada;Yes;No;No;No;Unknown Land Use (Historical Data Migration);Unknown Population Density (Historical Data Migration);Mainline Valve + Offset (km) Station 84;Level I;Standard Review;No;NULL;Station/Facility, Compression, Pipe;NULL;NPS 1/4;NULL;NULL;NULL;NULL;NULL;NULL;0;NULL;NULL;NULL;0;NULL;NULL;NULL;NULL;NULL;NULL;NULL;NULL;NULL;NULL;NULL;NULL;NULL;No;Replacement;NULL;No;NULL;NULL;No;No;NULL;Replacement;No
INC2008-079;Release of Substance;8/8/2008;Herbert;Saskatchewan;Spectra Energy Empress Management Inc. as General Partner and Agent for Spectra Energy Empress L.P.;Closed;50.539202;-107.30766;0.5;Propane;Gas;No;2008;2008/07/12 12:00:00 AM Mountain;2008/07/12 12:00:00 AM Mountain;Damage or deterioration mechanism, Equipment, Gasket/O-ring;Equipment Failure;Job or system factors, Excessive wear and tear, Use for wrong purpose;Maintenance;NULL;NULL;Operation;Employee / Contractor (Onsite);7/23/2012;Yes;No;Release of Substance;Propane;0.5;No;No;NULL;NULL;NULL;NULL;NULL;NULL;NULL;NULL;NULL;NULL;0;OPR;NULL;NULL;NULL;NULL;NULL;NULL;NULL;NULL;Canada;Yes;No;No;No;Unknown Land Use (Historical Data Migration);10 or fewer dwelling units per km;NULL;Level I;Standard Review;No;NULL;Station/Facility, Pumping, Pump;NULL;;NULL;NULL;NULL;NULL;NULL;NULL;0;NULL;NULL;NULL;NULL;NULL;NULL;NULL;NULL;NULL;NULL;NULL;NULL;NULL;NULL;NULL;NULL;NULL;No;Replacement;7/13/2008;No;NULL;NULL;No;No;7/13/2008;Replacement;No
INC2008-080;Serious Injury (NEB or TSB);8/15/2008;Valemount;British Columbia;Trans Mountain Pipeline ULC;Closed;53.024796;-119.151198;Not Applicable;Not Applicable;Not Applicable;Yes;2008;2008/08/14 08:00:00 PM Mountain;2008/08/14 08:00:00 PM Mountain;"Substandard Acts, Using defective equipment;Substandard Acts, Improper placement;Substandard Acts, Using equipment improperly";Incorrect Operation;"Personal factors, Improper motivation, Improper attempt to save time or effort;Job or system factors, Inadequate tools and equipment, Inadequate standards or specifications;Job or system factors, Excessive wear and tear, Inadequate maintenance;Job or system factors, Inadequate maintenance, Inadequate preventive, Assessment of needs;Job or system factors, Inadequate work standards, Inadequate maintenance of standards, Monitoring use of procedures or practices or rules";Human Factors, Maintenance, Standards and Procedures, Tools and Equipment;NULL;NULL;Construction;Employee / Contractor (Onsite);12/15/2010;No;No;Serious Injury (NEB or TSB);NULL;NULL;NULL;No;NULL;NULL;NULL;NULL;Fracture;1;NULL;No;NULL;NULL;0;OPR;TMX Anchor Loop;762.00000000, 914.00000000;158.1950834;Crude Oil;NULL;NULL;NULL;NULL;Canada;No;No;Yes;No;Unknown Land Use (Historical Data Migration);Unknown Population Density (Historical Data Migration);Kilometer Post 439;Level III;Category C;Yes;NULL;;NULL;;NULL;NULL;NULL;NULL;NULL;NULL;NULL;NULL;NULL;NULL;NULL;NULL;NULL;NULL;NULL;NULL;NULL;NULL;NULL;NULL;NULL;NULL;NULL;NULL;No;NULL;NULL;No;NULL;NULL;No;No;NULL;NULL;No
INC2008-084;Fire;8/26/2008;Not specified;Saskatchewan;Enbridge Pipelines Inc.;Closed;51.10223;-106.35299;Not Applicable;Not Applicable;Not Applicable;No;2008;2008/08/25 02:10:00 PM Central;2008/08/25 02:10:00 PM Central;Substandard Conditions, Fire and explosion hazards;External Interference;Job or system factors, Excessive wear and tear, Inadequate inspection and/or monitoring;Maintenance;NULL;NULL;Construction;Employee / Contractor (Onsite);8/15/2012;Yes;No;Fire;NULL;NULL;NULL;No;NULL;Equipment & Electrical;NULL;NULL;NULL;NULL;NULL;NULL;NULL;NULL;0;OPR;Line 3;610.00000000, 914.00000000, 914.40000000, 864.00000000;2334.948756;Crude Oil;NULL;NULL;NULL;NULL;Canada;No;No;Yes;Yes;Unknown Land Use (Historical Data Migration);10 or fewer dwelling units per km;Mile Post 252;Level I;Standard Review;No;NULL;Vehicle / mobile equipment;NULL;;NULL;NULL;NULL;NULL;NULL;NULL;0;NULL;NULL;NULL;NULL;NULL;NULL;NULL;NULL;NULL;NULL;NULL;NULL;NULL;NULL;NULL;NULL;NULL;No;NULL;NULL;No;NULL;NULL;No;No;NULL;NULL;No
INC2008-085;Fire;9/4/2008;Not specified;Saskatchewan;Enbridge Pipelines Inc.;Closed;51.44373;-107.37839;Not Applicable;Not Applicable;Not Applicable;No;2008;2008/09/04 11:43:00 AM Central;2008/09/04 11:43:00 AM Central;Damage or deterioration mechanism, Other Causes, Control System Malfunction;Equipment Failure;Job or system factors, Inadequate engineering, Inadequate monitoring of construction;Engineering and Planning;NULL;Transmission;Maintenance;Employee / Contractor (Onsite);12/21/2010;No;No;Fire;NULL;NULL;NULL;No;NULL;Equipment & Electrical;NULL;NULL;NULL;NULL;NULL;NULL;NULL;NULL;0;OPR;Line 4;1219.00000000, 914.00000000, 864.00000000;1248.909872;Crude Oil;NULL;NULL;NULL;NULL;Canada;Yes;No;No;No;Unknown Land Use (Historical Data Migration);Unknown Population Density (Historical Data Migration);NULL;Level I;Standard Review;No;NULL;;NULL;;NULL;NULL;NULL;NULL;NULL;NULL;NULL;NULL;NULL;NULL;NULL;NULL;NULL;NULL;NULL;NULL;NULL;NULL;NULL;NULL;NULL;NULL;NULL;NULL;No;NULL;NULL;No;NULL;NULL;No;No;NULL;NULL;No
INC2008-086;Release of Substance;8/28/2008;Vermilion Bay;Ontario;TransCanada PipeLines Limited;Closed;49.85542;-93.36393;Not Provided;Natural Gas - Sweet;Gas;No;2008;2008/08/28 11:30:00 AM Eastern;2008/08/28 11:30:00 AM Eastern;Damage or deterioration mechanism, Cracking, Corrosion Fatigue;Corrosion and Cracking;Job or system factors, Inadequate work standards, Inadequate maintenance of standards, Monitoring use of procedures or practices or rules;Standards and Procedures;NULL;NULL;Operation;Employee / Contractor (Onsite);1/19/2011;Yes;No;Release of Substance;Natural Gas - Sweet;0;No;No;NULL;NULL;NULL;NULL;NULL;NULL;NULL;NULL;NULL;NULL;0;OPR;NULL;NULL;NULL;NULL;NULL;NULL;NULL;NULL;Canada;No;No;Yes;No;Unknown Land Use (Historical Data Migration);10 or fewer dwelling units per km;Mainline Valve + Offset (km) MLV50 + 11.163;Level I;Standard Review;No;NULL;Pipeline, Pipe, Body;NULL;;NULL;NULL;NULL;NULL;NULL;NULL;NULL;NULL;NULL;NULL;NULL;NULL;NULL;NULL;NULL;NULL;NULL;NULL;6 o'clock;NULL;NULL;NULL;NULL;NULL;No;NULL;NULL;No;NULL;NULL;No;No;NULL;NULL;No
INC2008-087;Release of Substance;9/5/2008;Taylor;British Columbia;Westcoast Energy Inc., carrying on business as Spectra Energy Transmission;Closed;56.14631;-120.6692;0.1;Butane;Gas;No;2008;2008/09/05 12:00:00 AM Mountain;2008/09/05 07:00:00 AM Pacific;Damage or deterioration mechanism, External Interference, Company Contractor;External Interference;Personal factors, Lack of knowledge, Lack of situational awareness;Human Factors;NULL;NULL;Construction;NULL;7/27/2012;Yes;No;Release of Substance;Butane;0.1;No;No;NULL;NULL;NULL;NULL;NULL;NULL;NULL;NULL;NULL;NULL;0;PPR;N/A;NULL;NULL;NULL;NULL;NULL;NULL;NULL;Canada;No;No;No;No;Unknown Land Use (Historical Data Migration);Unknown Population Density (Historical Data Migration);NULL;Level I;Standard Review;No;NULL;Processing Plant;NULL;;NULL;NULL;NULL;NULL;NULL;NULL;NULL;NULL;NULL;NULL;NULL;NULL;NULL;NULL;NULL;NULL;NULL;NULL;NULL;NULL;NULL;NULL;NULL;NULL;No;Replacement;NULL;No;NULL;NULL;No;No;NULL;Replacement;No
INC2008-091;Serious Injury (NEB or TSB);9/16/2008;Pennfield;New Brunswick;Emera Brunswick Pipeline Company Ltd.;Closed;45.1982;-66.6422;Not Applicable;Not Applicable;Not Applicable;Yes;2008;2008/09/15 12:00:00 AM Mountain;2008/09/15 12:00:00 AM Mountain;Substandard Conditions, Defective tools, equipment or materials;External Interference;Job or system factors, Inadequate work standards, Inadequate maintenance of standards, Monitoring use of procedures or practices or rules;Standards and Procedures;NULL;NULL;Operation;Employee / Contractor (Onsite);7/27/2012;No;No;Serious Injury (NEB or TSB);NULL;NULL;NULL;No;NULL;NULL;NULL;NULL;Fracture;1;NULL;No;NULL;NULL;0;OPR;NULL;NULL;NULL;NULL;NULL;NULL;NULL;NULL;Canada;Yes;No;No;No;Unknown Land Use (Historical Data Migration);Unknown Population Density (Historical Data Migration);Off the Right of Way;Level I;Standard Review;No;NULL;;NULL;;NULL;NULL;NULL;NULL;NULL;NULL;NULL;NULL;NULL;NULL;NULL;NULL;NULL;NULL;NULL;NULL;NULL;NULL;NULL;NULL;NULL;NULL;NULL;NULL;No;Replacement;NULL;No;NULL;NULL;No;No;NULL;Replacement;No
INC2008-092;Serious Injury (NEB or TSB);9/16/2008;Valemount;British Columbia;Trans Mountain Pipeline Inc.;Closed;52.83128;-119.2645;Not Applicable;Not Applicable;Not Applicable;Yes;2008;2008/09/16 05:00:00 PM Pacific;2008/09/16 05:00:00 PM Pacific;"Substandard Conditions, Weather Related, Adverse weather;Substandard Acts, Failure to warn;Substandard Acts, Failure to secure;Substandard Acts, Improper placement;Substandard Acts, Improper position for task;Substandard Acts, Using equipment improperly";External Interference, Incorrect Operation;"Personal factors, Improper motivation, Improper attempt to save time or effort;Job or system factors, Inadequate leadership and/or supervision, Inadequate instructions, orientation and/or training;Job or system factors, Inadequate engineering, Inadequate standards, specifications and/or design criteria;Job or system factors, Inadequate tools and equipment, Inadequate standards or specifications";Engineering and Planning, Human Factors, Inadequate Supervision, Tools and Equipment;NULL;NULL;Construction;Employee / Contractor (Onsite);11/4/2008;No;No;Serious Injury (NEB or TSB);NULL;NULL;NULL;No;NULL;NULL;NULL;NULL;Fracture;1;NULL;No;NULL;NULL;0;OPR;NULL;NULL;NULL;NULL;NULL;NULL;NULL;NULL;Canada;No;No;Yes;No;Unknown Land Use (Historical Data Migration);Unknown Population Density (Historical Data Migration);Kilometer Post 458.1;Level I;Standard Review;No;NULL;;NULL;;NULL;NULL;NULL;NULL;NULL;NULL;NULL;NULL;NULL;NULL;NULL;NULL;NULL;NULL;NULL;NULL;NULL;NULL;NULL;NULL;NULL;NULL;NULL;NULL;No;NULL;NULL;No;NULL;NULL;No;No;NULL;NULL;No
INC2008-095;Release of Substance;9/26/2008;Falcon Lake;Manitoba;TransCanada PipeLines Limited;Closed;49.68098;-95.37458;Not Provided;Natural Gas - Sweet;Gas;No;2008;2008/09/25 03:35:00 PM Mountain;2008/09/25 03:35:00 PM Mountain;Damage or deterioration mechanism, Cracking, Mechanical Damage Delayed Cracking;Corrosion and Cracking;Job or system factors, Inadequate engineering, Inadequate monitoring of construction;Engineering and Planning;NULL;NULL;Operation;Employee / Contractor (Onsite);7/27/2012;Yes;No;Release of Substance;Natural Gas - Sweet;0;No;No;NULL;NULL;NULL;NULL;NULL;NULL;NULL;NULL;NULL;NULL;0;OPR;LINE 100-1;863.60000000, 762.00000000, 508.00000000;2595.724534;Natural Gas;NULL;NULL;NULL;NULL;Canada;No;No;Yes;No;Unknown Land Use (Historical Data Migration);Unknown Population Density (Historical Data Migration);NULL;Level I;Standard Review;No;NULL;Pipeline, Pipe, Body;NULL;NPS 30;NULL;359 - X52;NULL;9.5 mm = 0.375 in;NULL;NULL;6048;NULL;NULL;NULL;NULL;NULL;1957;NULL;NULL;NULL;NULL;NULL;NULL;External;Asphalt Mastic;NULL;Field Applied;NULL;No;Replacement;10/19/2008;No;NULL;NULL;No;No;10/19/2008;Replacement;No
INC2008-097;Fire;10/7/2008;Huntsville;Ontario;TransCanada PipeLines Limited;Closed;45.33806;-79.24126;Not Applicable;Not Applicable;Not Applicable;No;2008;2008/10/06 02:30:00 PM Mountain;2008/10/06 02:30:00 PM Mountain;Substandard Conditions, Inadequate guards or barriers;External Interference;"Job or system factors, Excessive wear and tear, Inadequate inspection and/or monitoring;Job or system factors, Inadequate maintenance, Inadequate preventive, Assessment of needs";Maintenance;NULL;NULL;Operation;Employee / Contractor (Onsite);4/14/2010;No;No;Fire;NULL;NULL;NULL;No;NULL;Equipment & Electrical;NULL;NULL;NULL;NULL;NULL;NULL;NULL;NULL;0;OPR;NULL;NULL;NULL;NULL;NULL;NULL;NULL;NULL;Canada;No;No;No;Yes;Unknown Land Use (Historical Data Migration);10 or fewer dwelling units per km;Kilometer Post;Level I;Standard Review;No;NULL;Pipeline, Auxiliary device(s) (please explain);NULL;;NULL;NULL;NULL;NULL;NULL;NULL;NULL;NULL;NULL;NULL;NULL;NULL;NULL;NULL;NULL;NULL;NULL;NULL;NULL;NULL;NULL;NULL;NULL;NULL;No;Replacement;10/13/2008;No;NULL;NULL;No;No;10/13/2008;Replacement;No
INC2008-098;Release of Substance;10/16/2008;Portage La Prairie;Manitoba;TransCanada PipeLines Limited;Closed;49.91211;-98.51757;Not Provided;Natural Gas - Sweet;Gas;No;2008;2008/10/16 02:30:00 PM Mountain;2008/10/16 02:30:00 PM Mountain;Damage or deterioration mechanism, External Interference, Third Party;External Interference;Job or system factors, Inadequate work standards, Inadequate maintenance of standards, Monitoring use of procedures or practices or rules;Standards and Procedures;NULL;NULL;Operation;Employee / Contractor (Onsite);7/27/2012;Yes;No;Release of Substance;Natural Gas - Sweet;0;No;No;NULL;NULL;NULL;NULL;NULL;NULL;NULL;NULL;NULL;NULL;0;OPR;LINE 100-2;609.60000000, 863.60000000, 762.00000000, 508.00000000, 914.40000000;3393.42642;Natural Gas;NULL;NULL;NULL;NULL;Canada;Yes;No;No;No;Unknown Land Use (Historical Data Migration);Unknown Population Density (Historical Data Migration);Mainline Valve + Offset (km) MLV 34 + 0;Level I;Standard Review;No;NULL;Station/Facility, Compression, Pipe;NULL;NPS 1/2;NULL;NULL;NULL;NULL;NULL;NULL;0;NULL;NULL;NULL;NULL;NULL;NULL;NULL;NULL;NULL;NULL;NULL;NULL;NULL;NULL;NULL;NULL;NULL;No;Replacement;10/18/2008;No;NULL;NULL;No;No;10/18/2008;Replacement;No
INC2008-103;Release of Substance;11/4/2008;Reynolds;Manitoba;TransCanada PipeLines Limited;Closed;49.65789;-96.16268;Not Provided;Natural Gas - Sweet;Gas;No;2008;2008/11/03 02:00:00 PM Mountain;2008/11/03 02:00:00 PM Mountain;Damage or deterioration mechanism, Equipment, Valve Seals or Packing;Equipment Failure;Job or system factors, Inadequate maintenance, Inadequate preventive, Assessment of needs;Maintenance;NULL;NULL;Operation;Employee / Contractor (Onsite);7/27/2012;Yes;No;Release of Substance;Natural Gas - Sweet;0;No;No;NULL;NULL;NULL;NULL;NULL;NULL;NULL;NULL;NULL;NULL;0;OPR;TCPL - Station 43 (Spruce Compresor Station);NULL;NULL;NULL;NULL;NULL;NULL;NULL;Canada;Yes;No;No;No;Unknown Land Use (Historical Data Migration);Unknown Population Density (Historical Data Migration);NULL;Level I;Standard Review;No;NULL;Station/Facility, Compression, Valve, Pressure relief, Other (please explain);NULL;NPS 2;NULL;NULL;NULL;NULL;NULL;NULL;0;NULL;NULL;NULL;NULL;NULL;NULL;NULL;NULL;NULL;NULL;NULL;NULL;NULL;NULL;NULL;NULL;NULL;No;Replacement;11/3/2008;No;NULL;NULL;No;No;11/3/2008;Replacement;No
INC2008-109;Fire, Release of Substance;11/20/2008;Taylor;British Columbia;Westcoast Energy Inc., carrying on business as Spectra Energy Transmission;Closed;56.14652;-120.66937;0.005;Mixed HVP Hydrocarbons;Gas;No;2008;2008/11/17 02:00:00 PM Mountain;2008/11/17 02:00:00 PM Mountain;Damage or deterioration mechanism, Equipment, Valve Seals or Packing;Equipment Failure;Job or system factors, Inadequate maintenance, Inadequate preventive, Assessment of needs;Maintenance;NULL;NULL;Operation;NULL;7/27/2012;Yes;No;Fire, Release of Substance;Mixed HVP Hydrocarbons;0.005;No;No;NULL;Equipment & Electrical;NULL;NULL;NULL;NULL;NULL;NULL;NULL;NULL;0;PPR;N/A;NULL;NULL;NULL;NULL;NULL;NULL;NULL;Canada;No;No;No;No;Unknown Land Use (Historical Data Migration);Unknown Population Density (Historical Data Migration);NULL;Level I;Standard Review;No;NULL;Processing Plant, Sulphur plant;NULL;;NULL;NULL;NULL;NULL;NULL;NULL;NULL;NULL;NULL;NULL;NULL;NULL;NULL;NULL;NULL;NULL;NULL;NULL;NULL;NULL;NULL;NULL;NULL;NULL;No;Replacement;NULL;No;NULL;NULL;No;No;NULL;Replacement;No
INC2008-110;Release of Substance;11/21/2008;Fort Nelson;British Columbia;Westcoast Energy Inc., carrying on business as Spectra Energy Transmission;Closed;59.20196;-121.5963;10;Condensate;Liquid;No;2008;2008/11/20 12:00:00 PM Mountain;2008/11/20 12:00:00 PM Mountain;Substandard Acts, Failure to follow procedure or policy or practice;Incorrect Operation;Job or system factors, Inadequate leadership and/or supervision, Inadequate instructions, orientation and/or training;Inadequate Supervision;NULL;NULL;Operation;Employee / Contractor (Onsite);8/15/2012;Yes;No;Release of Substance;Condensate;10;No;No;NULL;NULL;NULL;NULL;NULL;NULL;NULL;NULL;NULL;NULL;0;OPR;WEI - Cabin Lake Booster Station;NULL;NULL;NULL;NULL;NULL;NULL;NULL;Canada;Yes;No;No;No;Unknown Land Use (Historical Data Migration);Unknown Population Density (Historical Data Migration);NULL;Level I;Standard Review;No;NULL;;NULL;;NULL;NULL;NULL;NULL;NULL;NULL;NULL;NULL;NULL;NULL;NULL;NULL;NULL;NULL;NULL;NULL;NULL;NULL;NULL;NULL;NULL;NULL;NULL;NULL;No;NULL;NULL;No;NULL;NULL;No;No;NULL;NULL;No
INC2008-111;Release of Substance;11/26/2008;Chetwynd;British Columbia;Westcoast Energy Inc., carrying on business as Spectra Energy Transmission;Closed;55.56932;-121.94466;10;Amine;Miscellaneous;No;2008;2008/11/26 03:00:00 AM Pacific;2008/11/26 03:00:00 AM Pacific;Damage or deterioration mechanism, Construction, Defective Pipe or Component Body;Defect and Deterioration;Job or system factors, Inadequate maintenance, Inadequate reparative, Part substitution;Maintenance;NULL;NULL;Operation;NULL;7/30/2012;Yes;No;Release of Substance;Amine;10;No;No;NULL;NULL;NULL;NULL;NULL;NULL;NULL;NULL;NULL;NULL;0;PPR;N/A;NULL;NULL;NULL;NULL;NULL;NULL;NULL;Canada;No;No;No;No;Unknown Land Use (Historical Data Migration);10 or fewer dwelling units per km;NULL;Level I;Standard Review;No;NULL;Processing Plant, Sulphur plant;NULL;;NULL;NULL;NULL;NULL;NULL;NULL;NULL;NULL;NULL;NULL;NULL;NULL;NULL;NULL;NULL;NULL;NULL;NULL;NULL;NULL;NULL;NULL;NULL;NULL;No;Replacement;NULL;No;NULL;NULL;No;No;NULL;Replacement;No
INC2008-112;Fire;11/26/2008;McLeod Lake;British Columbia;Westcoast Energy Inc., carrying on business as Spectra Energy Transmission;Closed;55.03189;-123.03117;Not Applicable;Not Applicable;Not Applicable;No;2008;2008/11/26 04:25:00 PM Eastern;2008/11/26 04:25:00 PM Eastern;Damage or deterioration mechanism, Construction, Defective Pipe or Component Body;Defect and Deterioration;Job or system factors, Inadequate maintenance, Inadequate preventive, Lubrication and servicing;Maintenance;NULL;NULL;Maintenance;Employee / Contractor (Onsite);7/27/2012;Yes;No;Fire;NULL;NULL;NULL;No;NULL;Equipment & Electrical;NULL;NULL;NULL;NULL;NULL;NULL;NULL;NULL;0;OPR;WEI - McLeod Lake Compressor Station;NULL;NULL;NULL;NULL;NULL;NULL;NULL;Canada;Yes;No;No;No;Unknown Land Use (Historical Data Migration);10 or fewer dwelling units per km;NULL;Level I;Standard Review;No;NULL;Station/Facility, Compression, Compressor;NULL;;NULL;NULL;NULL;NULL;NULL;NULL;NULL;NULL;NULL;NULL;NULL;NULL;NULL;NULL;NULL;NULL;NULL;NULL;NULL;NULL;NULL;NULL;NULL;NULL;No;NULL;NULL;No;NULL;NULL;No;No;NULL;NULL;No
INC2008-113;Release of Substance, Adverse Environmental Effects;12/1/2008;Chetwynd;British Columbia;Westcoast Energy Inc., carrying on business as Spectra Energy Transmission;Closed;55.5692;-121.94446;2;Glycol;Miscellaneous;No;2008;2008/11/30 08:45:00 PM Mountain;2008/11/30 08:45:00 PM Mountain;Damage or deterioration mechanism, Construction, Defective Pipe or Component Body;Defect and Deterioration;Job or system factors, Inadequate work standards, Inadequate maintenance of standards, Monitoring use of procedures or practices or rules;Standards and Procedures;NULL;NULL;Operation;NULL;7/27/2012;Yes;No;Adverse Environmental Effects, Release of Substance;Glycol;2;No;No;NULL;NULL;NULL;NULL;NULL;NULL;NULL;NULL;NULL;NULL;0;PPR;N/A;NULL;NULL;NULL;NULL;NULL;NULL;NULL;Canada;No;No;No;No;Unknown Land Use (Historical Data Migration);10 or fewer dwelling units per km;Kilometer Post;Level I;Standard Review;No;NULL;;NULL;;NULL;NULL;NULL;NULL;NULL;NULL;NULL;NULL;NULL;NULL;NULL;NULL;NULL;NULL;NULL;NULL;NULL;NULL;NULL;NULL;NULL;NULL;NULL;NULL;No;NULL;NULL;No;NULL;NULL;No;No;NULL;NULL;No
INC2008-114;Release of Substance;12/2/2008;Winnipeg;Manitoba;TransCanada PipeLines Limited;Closed;49.68017;-96.64917;Not Provided;Natural Gas - Sweet;Gas;No;2008;2008/11/28 04:33:00 PM Central;2008/11/28 04:33:00 PM Central;Damage or deterioration mechanism, External Interference, Company Contractor;External Interference;Job or system factors, Inadequate work standards, Inadequate maintenance of standards, Monitoring use of procedures or practices or rules;Standards and Procedures;NULL;NULL;Operation;Employee / Contractor (Onsite);7/27/2012;Yes;No;Release of Substance;Natural Gas - Sweet;0;No;No;NULL;NULL;NULL;NULL;NULL;NULL;NULL;NULL;NULL;NULL;0;OPR;LINE 100-1;863.60000000, 762.00000000, 508.00000000;2595.724534;Natural Gas;NULL;NULL;NULL;NULL;Canada;No;No;Yes;No;Unknown Land Use (Historical Data Migration);10 or fewer dwelling units per km;Mainline Valve + Offset (km);Level I;Standard Review;No;NULL;Station/Facility, Metering, Delivering, Valve, Ball, Other (please explain);NULL;;NULL;NULL;NULL;NULL;NULL;NULL;NULL;NULL;NULL;NULL;NULL;NULL;NULL;NULL;NULL;NULL;NULL;NULL;NULL;NULL;NULL;NULL;NULL;NULL;No;Rebuilt;11/28/2008;No;NULL;NULL;No;No;11/28/2008;Repair;No
INC2008-115;Fire;12/2/2008;Charlie Lake;British Columbia;Westcoast Energy Inc., carrying on business as Spectra Energy Transmission;Closed;56.63822;-121.65102;Not Applicable;Not Applicable;Not Applicable;No;2008;2008/12/02 08:45:00 AM Pacific;2008/12/02 08:45:00 AM Pacific;Damage or deterioration mechanism, Equipment;Equipment Failure;"Job or system factors, Excessive wear and tear, Inadequate inspection and/or monitoring;Job or system factors, Inadequate work standards, Inadequate maintenance of standards, Monitoring use of procedures or practices or rules";Maintenance, Standards and Procedures;NULL;NULL;Operation;Employee / Contractor (Onsite);2/12/2015;Yes;No;Fire;NULL;NULL;NULL;No;NULL;Equipment & Electrical;NULL;NULL;NULL;NULL;NULL;NULL;NULL;NULL;0;OPR;WEI - Booster Station #3 - Kobes;NULL;NULL;NULL;NULL;NULL;NULL;NULL;Canada;Yes;No;No;No;Unknown Land Use (Historical Data Migration);10 or fewer dwelling units per km;Mile Post;Level I;Standard Review;No;NULL;;NULL;;NULL;NULL;NULL;NULL;NULL;NULL;NULL;NULL;NULL;NULL;NULL;NULL;NULL;NULL;NULL;NULL;NULL;NULL;NULL;NULL;NULL;NULL;NULL;NULL;No;NULL;NULL;No;NULL;NULL;No;No;NULL;NULL;No
INC2008-119;Release of Substance;12/8/2008;McLeod Lake;British Columbia;Westcoast Energy Inc., carrying on business as Spectra Energy Transmission;Closed;55.032;-123.03098;Not Provided;Natural Gas - Sweet;Gas;No;2008;2008/12/05 04:50:00 PM Pacific;2008/12/05 04:50:00 PM Pacific;Damage or deterioration mechanism, Construction, Defective Pipe or Component Body;Defect and Deterioration;Job or system factors, Inadequate maintenance, Inadequate reparative, Part substitution;Maintenance;NULL;NULL;Operation;Employee / Contractor (Onsite);7/27/2012;Yes;No;Release of Substance;Natural Gas - Sweet;0;No;No;NULL;NULL;NULL;NULL;NULL;NULL;NULL;NULL;NULL;NULL;0;OPR;WEI - McLeod Lake Compressor Station;NULL;NULL;NULL;NULL;NULL;NULL;NULL;Canada;Yes;No;No;No;Unknown Land Use (Historical Data Migration);10 or fewer dwelling units per km;NULL;Level I;Standard Review;No;NULL;Station/Facility, Compression, Fitting;NULL;;NULL;NULL;NULL;NULL;NULL;NULL;NULL;NULL;NULL;NULL;NULL;NULL;NULL;NULL;NULL;NULL;NULL;NULL;NULL;NULL;NULL;NULL;NULL;NULL;No;Replacement;NULL;No;NULL;NULL;No;No;NULL;Replacement;No
INC2008-120;Release of Substance;12/9/2008;Winnipeg;Manitoba;TransCanada PipeLines Limited;Closed;49.75544;-97.2305;Not Provided;Natural Gas - Sweet;Gas;No;2008;2008/12/08 12:00:00 AM Mountain;2008/12/08 09:30:00 AM Mountain;Damage or deterioration mechanism, Equipment, Valve Seals or Packing;Equipment Failure;Job or system factors, Inadequate maintenance, Inadequate preventive, Assessment of needs;Maintenance;NULL;NULL;Operation;Employee / Contractor (Onsite);1/19/2011;Yes;No;Release of Substance;Natural Gas - Sweet;0;No;No;NULL;NULL;NULL;NULL;NULL;NULL;NULL;NULL;NULL;NULL;0;OPR;NULL;NULL;NULL;NULL;NULL;NULL;NULL;NULL;Canada;Yes;No;No;No;Unknown Land Use (Historical Data Migration);10 or fewer dwelling units per km;Mainline Valve + Offset (km) 18km West of Winnipeg;Level I;Standard Review;No;NULL;Pipeline, Fitting, Nipple, Body;NULL;NPS 1/2;NULL;NULL;NULL;NULL;NULL;NULL;0;NULL;NULL;NULL;NULL;NULL;NULL;NULL;NULL;NULL;NULL;NULL;NULL;NULL;NULL;NULL;NULL;NULL;No;NULL;NULL;No;NULL;NULL;No;No;NULL;NULL;No
INC2008-121;Adverse Environmental Effects;12/10/2008;Goldboro;Nova Scotia;EnCana Corporation;Closed;45.18253;-61.65236;Not Applicable;Not Applicable;Not Applicable;No;2008;2008/12/03 03:00:00 PM Atlantic;2008/12/03 03:00:00 PM Atlantic;Damage or deterioration mechanism, Other Causes, Control System Malfunction;Equipment Failure;Job or system factors, Inadequate maintenance, Inadequate preventive, Assessment of needs;Maintenance;NULL;NULL;Construction;Employee / Contractor (Onsite);7/23/2012;No;No;Adverse Environmental Effects;NULL;NULL;NULL;No;NULL;NULL;NULL;NULL;NULL;NULL;NULL;NULL;NULL;NULL;0;OPR;NULL;NULL;NULL;NULL;NULL;NULL;NULL;NULL;Canada;No;No;No;Yes;Unknown Land Use (Historical Data Migration);10 or fewer dwelling units per km;100meters off shore;Level I;Standard Review;No;NULL;Pipeline, Pipe, Body;NULL;;NULL;NULL;NULL;NULL;NULL;NULL;NULL;NULL;NULL;NULL;NULL;NULL;NULL;NULL;NULL;NULL;NULL;NULL;NULL;NULL;NULL;NULL;NULL;NULL;No;NULL;NULL;No;NULL;NULL;No;No;NULL;NULL;No
INC2008-123;Fire;12/17/2008;Edmonton;Alberta;Enbridge Pipelines Inc.;Closed;53.5474;-113.35571;Not Applicable;Not Applicable;Not Applicable;No;2008;2008/12/15 10:55:00 AM Mountain;2008/12/15 10:55:00 AM Mountain;Substandard Conditions, Fire and explosion hazards;External Interference;Job or system factors, Inadequate maintenance, Inadequate preventive, Assessment of needs;Maintenance;NULL;NULL;Construction;Employee / Contractor (Onsite);7/27/2012;No;No;Fire;NULL;NULL;NULL;No;NULL;Under Investigation or Unknown;NULL;NULL;NULL;NULL;NULL;NULL;NULL;NULL;0;OPR;EPI - Edmonton Terminal;NULL;NULL;NULL;NULL;NULL;NULL;NULL;Canada;Yes;No;No;No;Unknown Land Use (Historical Data Migration);Contains buildings greater than 4 stories above ground;Kilometer Post;Level I;Standard Review;No;NULL;Station/Facility, Compression, Compressor;NULL;;NULL;NULL;NULL;NULL;NULL;NULL;0;NULL;NULL;NULL;NULL;NULL;NULL;NULL;NULL;NULL;NULL;NULL;NULL;NULL;NULL;NULL;NULL;NULL;No;NULL;NULL;No;NULL;NULL;No;No;NULL;NULL;No
INC2008-128;Release of Substance;1/13/2009;Hearst;Ontario;TransCanada PipeLines Limited;Closed;49.76492;-84.91824;Not Provided;Natural Gas - Sweet;Gas;No;2009;2008/02/04 12:00:00 AM Mountain;2008/12/14 12:00:00 AM Mountain;Damage or deterioration mechanism, Cracking, Fatigue;Corrosion and Cracking;Job or system factors, Inadequate engineering, Inadequate monitoring of construction;Engineering and Planning;NULL;NULL;Operation;Employee / Contractor (Onsite);7/23/2012;Yes;No;Release of Substance;Natural Gas - Sweet;0;No;No;NULL;NULL;NULL;NULL;NULL;NULL;NULL;NULL;NULL;NULL;0;OPR;TCPL - Station 86 (Hearst Compressor Station);NULL;NULL;NULL;NULL;NULL;NULL;NULL;Canada;Yes;No;No;No;Unknown Land Use (Historical Data Migration);Unknown Population Density (Historical Data Migration);NULL;Level I;Standard Review;No;NULL;Station/Facility, Compression, Pipe;NULL;;NULL;NULL;NULL;NULL;NULL;NULL;NULL;NULL;NULL;NULL;NULL;NULL;NULL;NULL;NULL;NULL;NULL;NULL;NULL;NULL;NULL;NULL;NULL;NULL;No;Replacement;12/14/2008;No;NULL;NULL;No;No;12/14/2008;Replacement;No
INC2009-002;Release of Substance;1/15/2009;Lincoln;Ontario;TransCanada PipeLines Limited;Closed;43.11405;-79.46307;Not Provided;Natural Gas - Sweet;Gas;No;2009;2009/01/14 09:00:00 PM Mountain;2009/01/14 11:00:00 PM Eastern;Damage or deterioration mechanism, Cracking, Fatigue;Corrosion and Cracking;Job or system factors, Excessive wear and tear, Inadequate maintenance;Maintenance;NULL;NULL;Operation;Employee / Contractor (Onsite);7/23/2012;Yes;No;Release of Substance;Natural Gas - Sweet;0;No;No;NULL;NULL;NULL;NULL;NULL;NULL;NULL;NULL;NULL;NULL;0;OPR;TCPL - Station 211 (Lincoln Compressor Station);NULL;NULL;NULL;NULL;NULL;NULL;NULL;Canada;Yes;No;No;No;Unknown Land Use (Historical Data Migration);Unknown Population Density (Historical Data Migration);Mile Post 211;Level I;Standard Review;No;NULL;Station/Facility, Compression, Pipe;NULL;;NULL;NULL;NULL;NULL;NULL;NULL;0;NULL;NULL;NULL;NULL;NULL;NULL;NULL;NULL;NULL;NULL;NULL;NULL;NULL;NULL;NULL;NULL;NULL;No;Replacement;1/15/2009;No;NULL;NULL;No;No;1/15/2009;Replacement;No
INC2009-009;Serious Injury (NEB or TSB);2/9/2009;White City;Saskatchewan;Enbridge Pipelines Inc.;Closed;50.44344;-104.35655;Not Applicable;Not Applicable;Not Applicable;Yes;2009;2009/02/09 03:30:00 PM Mountain;2009/02/09 03:30:00 PM Mountain;"Damage or deterioration mechanism, Other Causes, Control System Malfunction;Substandard Acts, Improper placement";Equipment Failure, Incorrect Operation;"Personal factors, Lack of knowledge, Lack of experience;Job or system factors, Excessive wear and tear, Improper extension of service life;Job or system factors, Excessive wear and tear, Inadequate maintenance;Job or system factors, Inadequate work standards, Inadequate maintenance of standards, Monitoring use of procedures or practices or rules";Human Factors, Maintenance, Standards and Procedures;NULL;NULL;Construction;Employee / Contractor (Onsite);12/22/2010;No;No;Serious Injury (NEB or TSB);NULL;NULL;NULL;No;NULL;NULL;NULL;NULL;Fracture;1;NULL;No;NULL;NULL;0;OPR;NULL;NULL;NULL;NULL;NULL;NULL;NULL;NULL;Canada;Yes;No;No;No;Unknown Land Use (Historical Data Migration);46 or more dwelling units per km;Off the Right of Way;Level III;Category C;Yes;NULL;;NULL;;NULL;NULL;NULL;NULL;NULL;NULL;NULL;NULL;NULL;NULL;NULL;NULL;NULL;NULL;NULL;NULL;NULL;NULL;NULL;NULL;NULL;NULL;NULL;NULL;No;NULL;NULL;No;NULL;NULL;No;No;NULL;NULL;No
INC2009-010;Release of Substance;2/9/2009;Lincoln;Ontario;TransCanada PipeLines Limited;Closed;43.11368;-79.46307;Not Provided;Fuel Gas;Gas;No;2009;2009/02/06 07:07:00 PM Eastern;2009/02/06 07:07:00 PM Eastern;Damage or deterioration mechanism, Construction, Defective Pipe or Component Body;Defect and Deterioration;Job or system factors, Excessive wear and tear, Improper loading or rate of use;Maintenance;NULL;NULL;Operation;Employee / Contractor (Onsite);7/27/2012;Yes;No;Release of Substance;Fuel Gas;0;No;No;NULL;NULL;NULL;NULL;NULL;NULL;NULL;NULL;NULL;NULL;0;OPR;NULL;NULL;NULL;NULL;NULL;NULL;NULL;NULL;Canada;Yes;No;No;No;Unknown Land Use (Historical Data Migration);Unknown Population Density (Historical Data Migration);Mile Post 211;Level I;Standard Review;No;NULL;Station/Facility, Compression, Pipe;NULL;;NULL;NULL;NULL;NULL;NULL;NULL;NULL;NULL;NULL;NULL;NULL;NULL;NULL;NULL;NULL;NULL;NULL;NULL;NULL;NULL;NULL;NULL;NULL;NULL;No;Replacement;2/6/2009;No;NULL;NULL;No;No;2/6/2009;Replacement;No
INC2009-015;Serious Injury (NEB or TSB), Release of Substance;2/20/2009;Wonowon;British Columbia;Westcoast Energy Inc., carrying on business as Spectra Energy Transmission;Closed;56.72686;-121.81832;0.0001;Natural Gas - Sour;Gas;Yes;2009;2009/02/20 09:00:00 AM Mountain;2009/02/20 09:00:00 AM Mountain;"Damage or deterioration mechanism, Material Loss, Internal Material Loss;Substandard Acts, Failure to follow procedure or policy or practice";Corrosion and Cracking, Incorrect Operation;"Job or system factors, Inadequate leadership and/or supervision, Inadequate instructions, orientation and/or training;Job or system factors, Inadequate engineering, Inadequate standards, specifications and/or design criteria";Engineering and Planning, Inadequate Supervision;NULL;NULL;Operation;Employee / Contractor (Onsite);7/23/2012;Yes;No;Release of Substance, Serious Injury (NEB or TSB);Natural Gas - Sour;0.0001;No;No;NULL;NULL;NULL;NULL;Lost Consciousness;2;NULL;No;NULL;NULL;0;OPR;NULL;NULL;NULL;NULL;NULL;NULL;NULL;NULL;Canada;Yes;No;No;No;Unknown Land Use (Historical Data Migration);10 or fewer dwelling units per km;Kilometer Post;Level III;Category C;Yes;NULL;Station/Facility, Pigging, Launching, Piping;API;NPS 18;Carbon Steel;290 - X42;NULL;9.5 mm = 0.375 in;NULL;NULL;800;NULL;NULL;NULL;NULL;NULL;NULL;NULL;NULL;NULL;Straight;Electric Resistance Welded;NULL;Internal;NULL;NULL;NULL;NULL;No;Rebuilt;NULL;No;NULL;NULL;No;No;NULL;Repair;No
INC2009-019;Release of Substance;3/5/2009;Portage La Prairie;Manitoba;TransCanada PipeLines Limited;Closed;49.91175;-98.51757;2.5;Lube Oil;Liquid;No;2009;2009/03/04 04:20:00 PM Central;2009/03/04 04:20:00 PM Central;Damage or deterioration mechanism, Construction, Defective Pipe or Component Body;Defect and Deterioration;Job or system factors, Excessive wear and tear, Inadequate inspection and/or monitoring;Maintenance;NULL;NULL;Operation;Employee / Contractor (Onsite);7/23/2012;Yes;No;Release of Substance;Lube Oil;2.5;No;No;NULL;NULL;NULL;NULL;NULL;NULL;NULL;NULL;NULL;NULL;0;OPR;TCPL - Station 34 (Portage La Prarie Comp. Stn);NULL;NULL;NULL;NULL;NULL;NULL;NULL;Canada;Yes;No;No;No;Unknown Land Use (Historical Data Migration);Unknown Population Density (Historical Data Migration);NULL;Level I;Standard Review;No;NULL;Station/Facility, Compression, Pipe;NULL;NPS 1/2;NULL;NULL;NULL;NULL;NULL;NULL;0;NULL;NULL;NULL;NULL;NULL;NULL;NULL;NULL;NULL;NULL;NULL;NULL;NULL;NULL;NULL;NULL;NULL;No;Replacement;NULL;No;NULL;NULL;No;No;NULL;Replacement;No
INC2009-021;Release of Substance;3/10/2009;Potter;Ontario;TransCanada PipeLines Limited;Closed;48.87172;-80.89396;Not Provided;Natural Gas - Sweet;Gas;No;2009;2009/03/09 10:43:00 AM Mountain;2009/03/09 10:43:00 AM Mountain;Damage or deterioration mechanism, Construction, Defective Pipe or Component Body;Defect and Deterioration;Job or system factors, Excessive wear and tear, Improper loading or rate of use;Maintenance;NULL;NULL;Operation;Employee / Contractor (Onsite);7/27/2012;Yes;No;Release of Substance;Natural Gas - Sweet;0;No;No;NULL;NULL;NULL;NULL;NULL;NULL;NULL;NULL;NULL;NULL;0;OPR;TCPL - Station 102 (Potter Compressor Station);NULL;NULL;NULL;NULL;NULL;NULL;NULL;Canada;Yes;No;No;No;Unknown Land Use (Historical Data Migration);Unknown Population Density (Historical Data Migration);NULL;Level I;Standard Review;No;NULL;Station/Facility, Compression, Pipe;NULL;;NULL;NULL;NULL;NULL;NULL;NULL;0;NULL;NULL;NULL;NULL;NULL;NULL;NULL;NULL;NULL;NULL;NULL;NULL;NULL;NULL;NULL;NULL;NULL;No;Replacement;3/9/2009;No;NULL;NULL;No;No;3/9/2009;Replacement;No
INC2009-024;Serious Injury (NEB or TSB);3/13/2009;Sarnia;Ontario;Enbridge Pipelines Inc.;Closed;42.97494;-82.40703;Not Applicable;Not Applicable;Not Applicable;Yes;2009;2009/03/13 04:30:00 PM Eastern;2009/03/13 04:30:00 PM Eastern;"Substandard Acts, Failure to secure;Substandard Acts, Under influence of alcohol and/or other drugs";Incorrect Operation;Personal factors, Physical or physiological stress, Drugs;Human Factors;NULL;NULL;Maintenance;Employee / Contractor (Onsite);12/22/2010;No;No;Serious Injury (NEB or TSB);NULL;NULL;NULL;No;NULL;NULL;NULL;NULL;Lost Consciousness;1;NULL;No;NULL;NULL;0;OPR;EPI - Sarnia Pump Station;NULL;NULL;NULL;NULL;NULL;NULL;NULL;Canada;No;Yes;No;Yes;Unknown Land Use (Historical Data Migration);Unknown Population Density (Historical Data Migration);Off the Right of Way;Level I;Standard Review;No;NULL;;NULL;;NULL;NULL;NULL;NULL;NULL;NULL;NULL;NULL;NULL;NULL;NULL;NULL;NULL;NULL;NULL;NULL;NULL;NULL;NULL;NULL;NULL;NULL;NULL;NULL;No;NULL;NULL;No;NULL;NULL;No;No;NULL;NULL;No
INC2009-026;Release of Substance;3/23/2009;Not specified;British Columbia;Westcoast Energy Inc., carrying on business as Spectra Energy Transmission;Closed;57.31724;-120.82153;Not Provided;Natural Gas - Sour;Gas;No;2009;NULL;2009/03/23 04:30:00 PM Mountain;Damage or deterioration mechanism, External Interference, Third Party;External Interference;Job or system factors, Inadequate communications, Inadequate communication methods ;Failure in communication;NULL;NULL;Operation;Employee / Contractor (Onsite);7/27/2012;Yes;No;Release of Substance;Natural Gas - Sour;0;No;No;NULL;NULL;NULL;NULL;NULL;NULL;NULL;NULL;NULL;NULL;0;OPR;"10"" Dahl Pipeline";273.1;30.95531555;Natural Gas Sour;NULL;NULL;NULL;NULL;Canada;Yes;No;No;No;Unknown Land Use (Historical Data Migration);Unknown Population Density (Historical Data Migration);NULL;Level I;Standard Review;No;NULL;Station/Facility, Metering, Delivering, Piping;NULL;NPS 1/4;NULL;NULL;NULL;NULL;NULL;NULL;0;NULL;NULL;NULL;NULL;NULL;NULL;NULL;NULL;NULL;NULL;NULL;NULL;NULL;NULL;NULL;NULL;NULL;No;Replacement;NULL;No;NULL;NULL;No;No;NULL;Replacement;No
INC2009-031;Release of Substance;4/7/2009;Tumbler Ridge;British Columbia;Westcoast Energy Inc., carrying on business as Spectra Energy Transmission;Closed;54.97941;-121.06074;Not Provided;Natural Gas - Sour;Gas;No;2009;2009/04/07 02:00:00 PM Pacific;2009/04/07 02:00:00 PM Pacific;Damage or deterioration mechanism, Equipment, Valve Seals or Packing;Equipment Failure;"Job or system factors, Excessive wear and tear, Inadequate inspection and/or monitoring;Job or system factors, Inadequate maintenance, Inadequate reparative, Part substitution";Maintenance;NULL;NULL;Operation;Employee / Contractor (Onsite);12/4/2013;Yes;No;Release of Substance;Natural Gas - Sour;0;No;No;NULL;NULL;NULL;NULL;NULL;NULL;NULL;NULL;NULL;NULL;0;OPR;NULL;NULL;NULL;NULL;NULL;NULL;NULL;NULL;Canada;Yes;No;No;No;Unknown Land Use (Historical Data Migration);Unknown Population Density (Historical Data Migration);NULL;Level I;Standard Review;No;NULL;Pipeline, Valve, Ball, Seal/Packing;NULL;;NULL;NULL;NULL;NULL;NULL;NULL;NULL;NULL;NULL;NULL;NULL;NULL;NULL;NULL;NULL;NULL;NULL;NULL;NULL;NULL;NULL;NULL;NULL;NULL;No;Replacement;NULL;No;NULL;NULL;No;No;NULL;Replacement;No
INC2009-032;Release of Substance;4/8/2009;Mattice;Ontario;TransCanada PipeLines Limited;Closed;49.58574;-83.16712;Not Provided;Natural Gas - Sweet;Gas;No;2009;2009/04/08 09:30:00 AM Mountain;2009/04/08 09:30:00 AM Mountain;Damage or deterioration mechanism, Geotechnical Failure, Frost heave;Natural Force Damage;Job or system factors, Inadequate engineering, Inadequate monitoring of construction;Engineering and Planning;NULL;NULL;Operation;Employee / Contractor (Onsite);12/4/2013;Yes;No;Release of Substance;Natural Gas - Sweet;0;No;No;NULL;NULL;NULL;NULL;NULL;NULL;NULL;NULL;NULL;NULL;0;OPR;TCPL - Station 92 (Mattice Compressor Station);NULL;NULL;NULL;NULL;NULL;NULL;NULL;Canada;Yes;No;No;No;Unknown Land Use (Historical Data Migration);Unknown Population Density (Historical Data Migration);Mainline Valve + Offset (km);Level I;Standard Review;No;NULL;Station/Facility, Compression, Pipe;NULL;;NULL;NULL;NULL;NULL;NULL;NULL;NULL;NULL;NULL;NULL;NULL;NULL;NULL;NULL;NULL;NULL;NULL;NULL;NULL;NULL;NULL;NULL;NULL;NULL;No;Rebuilt;4/9/2009;No;NULL;NULL;No;No;4/9/2009;Repair;No
INC2009-034;Release of Substance;4/23/2009;Hamilton;Ontario;TransCanada PipeLines Limited;Closed;43.35064;-80.1193;Not Provided;Natural Gas - Sweet;Gas;No;2009;NULL;2009/04/20 03:40:00 PM Eastern;Damage or deterioration mechanism, Cracking, Corrosion Fatigue;Corrosion and Cracking;Job or system factors, Excessive wear and tear, Improper loading or rate of use;Maintenance;NULL;NULL;Operation;Employee / Contractor (Onsite);7/27/2012;Yes;No;Release of Substance;Natural Gas - Sweet;0;No;No;NULL;NULL;NULL;NULL;NULL;NULL;NULL;NULL;NULL;NULL;0;OPR;TCPL - Station 1301 (Kirkwall Compressor Station);NULL;NULL;NULL;NULL;NULL;NULL;NULL;Canada;Yes;No;No;No;Unknown Land Use (Historical Data Migration);Unknown Population Density (Historical Data Migration);NULL;Level I;Standard Review;No;NULL;Station/Facility, Compression, Piping, Weld;NULL;NPS 1;Stainless Steel;NULL;NULL;NULL;NULL;NULL;0;NULL;NULL;NULL;NULL;NULL;NULL;NULL;NULL;NULL;NULL;NULL;NULL;NULL;NULL;NULL;NULL;NULL;No;Replacement;NULL;No;NULL;NULL;No;No;NULL;Replacement;No
INC2009-035;Fire, Release of Substance;4/23/2009;Fort Nelson;British Columbia;Westcoast Energy Inc., carrying on business as Spectra Energy Transmission;Closed;58.65325;-122.68501;0.004;Sulphur;Miscellaneous;No;2009;NULL;2009/04/19 10:15:00 AM Mountain;Damage or deterioration mechanism, Structural Degradation, Corrosion Fatigue;Defect and Deterioration;Job or system factors, Inadequate maintenance, Inadequate reparative, Part substitution;Maintenance;NULL;NULL;Operation;NULL;7/27/2012;Yes;No;Fire, Release of Substance;Sulphur;0.004;No;No;NULL;Equipment & Electrical;NULL;NULL;NULL;NULL;NULL;NULL;NULL;NULL;0;PPR;WEI - Fort Nelson Gas Plant;NULL;NULL;NULL;NULL;NULL;NULL;NULL;Canada;No;No;No;No;Unknown Land Use (Historical Data Migration);Unknown Population Density (Historical Data Migration);NULL;Level I;Standard Review;No;NULL;;NULL;;NULL;NULL;NULL;NULL;NULL;NULL;NULL;NULL;NULL;NULL;NULL;NULL;NULL;NULL;NULL;NULL;NULL;NULL;NULL;NULL;NULL;NULL;NULL;NULL;No;NULL;NULL;No;NULL;NULL;No;No;NULL;NULL;No
INC2009-036;Release of Substance;4/30/2009;Taylor;British Columbia;Westcoast Energy Inc., carrying on business as Spectra Energy Transmission;Closed;56.14652;-120.66917;Not Provided;Natural Gas - Sour;Gas;No;2009;2009/04/09 05:00:00 AM Pacific;2009/04/09 06:29:00 AM Pacific;"Substandard Acts, Failure to warn;Substandard Conditions, Defective tools, equipment or materials;Substandard Conditions, Inadequate instructions or procedures";External Interference, Incorrect Operation;Job or system factors, Inadequate work standards, Inadequate maintenance of standards, Monitoring use of procedures or practices or rules;Standards and Procedures;NULL;NULL;Operation;NULL;5/29/2009;Yes;No;Release of Substance;Natural Gas - Sour;0;No;No;NULL;NULL;NULL;NULL;NULL;NULL;NULL;NULL;NULL;NULL;0;PPR;WEI - McMahon Gas Plant (Taylor Gas Plant);NULL;NULL;NULL;NULL;NULL;NULL;NULL;Canada;No;No;No;No;Unknown Land Use (Historical Data Migration);Unknown Population Density (Historical Data Migration);NULL;Level I;Standard Review;No;NULL;Processing Plant, Flare;ASME;;NULL;NULL;NULL;NULL;NULL;NULL;0;NULL;NULL;NULL;NULL;NULL;NULL;NULL;NULL;NULL;NULL;NULL;NULL;NULL;NULL;NULL;NULL;NULL;No;NULL;NULL;No;NULL;NULL;No;No;NULL;NULL;No
INC2009-037;Release of Substance;5/1/2009;Upsala;Ontario;TransCanada PipeLines Limited;Closed;49.03329;-90.51006;Not Provided;Natural Gas - Sweet;Gas;No;2009;2009/05/01 08:45:00 AM Mountain;2009/05/01 08:45:00 AM Mountain;Damage or deterioration mechanism, Cracking, Corrosion Fatigue;Corrosion and Cracking;Job or system factors, Inadequate engineering, Inadequate monitoring of construction;Engineering and Planning;NULL;NULL;Operation;Employee / Contractor (Onsite);7/27/2012;Yes;No;Release of Substance;Natural Gas - Sweet;0;No;No;NULL;NULL;NULL;NULL;NULL;NULL;NULL;NULL;NULL;NULL;0;OPR;TCPL - Station 62 (Upsala Compressor Station);NULL;NULL;NULL;NULL;NULL;NULL;NULL;Canada;Yes;No;No;No;Unknown Land Use (Historical Data Migration);Unknown Population Density (Historical Data Migration);NULL;Level I;Standard Review;No;NULL;Station/Facility, Compression, Pipe;NULL;;NULL;NULL;NULL;NULL;NULL;NULL;NULL;NULL;NULL;NULL;NULL;NULL;NULL;NULL;NULL;NULL;NULL;NULL;NULL;NULL;NULL;NULL;NULL;NULL;No;Replacement;5/1/2009;No;NULL;NULL;No;No;5/1/2009;Replacement;No
INC2009-039;Release of Substance;5/7/2009;Vegreville;Alberta;NOVA Gas Transmission Ltd.;Closed;53.63705;-112.01828;Not Provided;Natural Gas - Sweet;Gas;No;2009;2009/05/06 01:35:00 PM Mountain;2009/05/06 01:35:00 PM Mountain;Damage or deterioration mechanism, Construction, Defective Pipe or Component Body;Defect and Deterioration;Job or system factors, Inadequate work standards, Inadequate development of standards, Procedures or practices or rules;Standards and Procedures;NULL;NULL;Operation;Employee / Contractor (Onsite);7/27/2012;Yes;No;Release of Substance;Natural Gas - Sweet;0;No;No;NULL;NULL;NULL;NULL;NULL;NULL;NULL;NULL;NULL;NULL;0;OPR;NULL;NULL;NULL;NULL;NULL;NULL;NULL;NULL;Canada;Yes;No;No;No;Unknown Land Use (Historical Data Migration);Unknown Population Density (Historical Data Migration);NULL;Level I;Standard Review;No;NULL;;NULL;NPS 3/8;NULL;NULL;NULL;NULL;NULL;NULL;0;NULL;NULL;NULL;NULL;NULL;NULL;NULL;NULL;NULL;NULL;NULL;NULL;NULL;NULL;NULL;NULL;NULL;No;Replacement;5/7/2009;No;NULL;NULL;No;No;5/7/2009;Replacement;No
INC2009-040;Release of Substance;5/7/2009;Burnaby;British Columbia;Trans Mountain Pipeline ULC;Closed;49.26849;-122.93134;305;Crude Oil - Sweet;Liquid;No;2009;2009/05/06 10:00:00 PM Mountain;2009/05/06 10:00:00 PM Mountain;Damage or deterioration mechanism, Construction, Defective Other Joint;Defect and Deterioration;"Job or system factors, Inadequate engineering, Inadequate standards, specifications and/or design criteria;Job or system factors, Inadequate tools and equipment, Inadequate assessment of needs and risks;Job or system factors, Inadequate tools and equipment, Inadequate standards or specifications;Job or system factors, Inadequate tools and equipment, Inadequate adjustment or repair or maintenance;Job or system factors, Inadequate work standards, Inadequate monitoring of compliance ";Engineering and Planning, Standards and Procedures, Tools and Equipment;NULL;NULL;Maintenance;Employee / Contractor (Onsite);6/3/2011;Yes;No;Release of Substance;Crude Oil - Sweet;305;No;No;NULL;NULL;NULL;NULL;NULL;NULL;NULL;NULL;NULL;NULL;0;OPR;NULL;NULL;NULL;NULL;NULL;NULL;NULL;NULL;Canada;Yes;No;No;No;Unknown Land Use (Historical Data Migration);Unknown Population Density (Historical Data Migration);NULL;Level III;Category C;Yes;REM-0083;;NULL;;NULL;NULL;NULL;NULL;NULL;NULL;NULL;NULL;NULL;NULL;NULL;NULL;NULL;NULL;NULL;NULL;NULL;NULL;NULL;NULL;NULL;NULL;NULL;NULL;No;NULL;NULL;No;NULL;NULL;No;No;NULL;NULL;No
INC2009-041;Release of Substance;5/11/2009;Valleyview;Alberta;NOVA Gas Transmission Ltd.;Closed;54.93272;-117.25214;Not Provided;Natural Gas - Sweet;Gas;No;2009;2009/05/11 08:15:00 AM Mountain;2009/05/11 08:15:00 AM Mountain;Damage or deterioration mechanism, Material Loss, External Material Loss;Corrosion and Cracking;Job or system factors, Excessive wear and tear, Inadequate planning of use;Maintenance;NULL;NULL;Operation;Employee / Contractor (Onsite);7/27/2012;Yes;No;Release of Substance;Natural Gas - Sweet;0;No;No;NULL;NULL;NULL;NULL;NULL;NULL;NULL;NULL;NULL;NULL;0;OPR;NULL;NULL;NULL;NULL;NULL;NULL;NULL;NULL;Canada;No;No;Yes;No;Unknown Land Use (Historical Data Migration);Unknown Population Density (Historical Data Migration);NULL;Level I;Standard Review;No;NULL;;NULL;;NULL;NULL;NULL;NULL;NULL;NULL;NULL;NULL;NULL;NULL;NULL;NULL;NULL;NULL;NULL;NULL;NULL;NULL;NULL;NULL;NULL;NULL;NULL;NULL;No;NULL;NULL;No;NULL;NULL;No;No;NULL;NULL;No
INC2009-042;Release of Substance;5/14/2009;Not specified;Quebec;TransCanada PipeLines Limited;Closed;45.31394;-73.48289;Not Provided;Natural Gas - Sweet;Gas;No;2009;2009/05/07 09:15:00 AM Mountain;2009/05/07 09:15:00 AM Mountain;Damage or deterioration mechanism, Equipment, Valve Seals or Packing;Equipment Failure;Job or system factors, Excessive wear and tear, Inadequate inspection and/or monitoring;Maintenance;NULL;NULL;Operation;Employee / Contractor (Onsite);7/23/2012;Yes;No;Release of Substance;Natural Gas - Sweet;0;No;No;NULL;NULL;NULL;NULL;NULL;NULL;NULL;NULL;NULL;NULL;0;OPR;TCPL - Station 802 (Candiac Compressor Station);NULL;NULL;NULL;NULL;NULL;NULL;NULL;Canada;Yes;No;No;No;Unknown Land Use (Historical Data Migration);Unknown Population Density (Historical Data Migration);NULL;Level I;Standard Review;No;NULL;Station/Facility, Compression, Valve;NULL;;NULL;NULL;NULL;NULL;NULL;NULL;NULL;NULL;NULL;NULL;NULL;NULL;NULL;NULL;NULL;NULL;NULL;NULL;NULL;NULL;NULL;NULL;NULL;NULL;No;NULL;NULL;No;NULL;NULL;No;No;NULL;NULL;No
INC2009-043;Fire;5/15/2009;Fort Nelson;British Columbia;Westcoast Energy Inc., carrying on business as Spectra Energy Transmission;Closed;58.65334;-122.68482;Not Applicable;Not Applicable;Not Applicable;No;2009;2009/05/15 12:30:00 PM Mountain;2009/05/15 12:30:00 PM Mountain;Damage or deterioration mechanism, Equipment, Valve Seals or Packing;Equipment Failure;Job or system factors, Excessive wear and tear, Inadequate inspection and/or monitoring;Maintenance;NULL;NULL;Operation;NULL;7/23/2012;No;No;Fire;NULL;NULL;NULL;No;NULL;Equipment & Electrical;NULL;NULL;NULL;NULL;NULL;NULL;NULL;NULL;0;PPR;WEI - Fort Nelson Gas Plant;NULL;NULL;NULL;NULL;NULL;NULL;NULL;Canada;No;No;No;No;Unknown Land Use (Historical Data Migration);Unknown Population Density (Historical Data Migration);NULL;Level I;Standard Review;No;NULL;;NULL;;NULL;NULL;NULL;NULL;NULL;NULL;NULL;NULL;NULL;NULL;NULL;NULL;NULL;NULL;NULL;NULL;NULL;NULL;NULL;NULL;NULL;NULL;NULL;NULL;No;NULL;NULL;No;NULL;NULL;No;No;NULL;NULL;No
INC2009-045;Release of Substance;5/22/2009;Rosetown;Saskatchewan;Kinder Morgan Cochin ULC;Closed;51.55484;-107.996;6.36;Propane;Gas;No;2009;2009/05/22 05:00:00 AM Central;2009/05/22 06:00:00 AM Central;Damage or deterioration mechanism, Construction, Defective Pipe or Component Body;Defect and Deterioration;Job or system factors, Inadequate work standards, Inadequate maintenance of standards, Monitoring use of procedures or practices or rules;Standards and Procedures;NULL;NULL;Operation;Employee / Contractor (Onsite);7/23/2012;Yes;No;Release of Substance;Propane;6.36;No;No;NULL;NULL;NULL;NULL;NULL;NULL;NULL;NULL;NULL;NULL;0;OPR;Cochin Soveriegn Station;NULL;NULL;NULL;NULL;NULL;NULL;NULL;Canada;Yes;No;No;No;Unknown Land Use (Historical Data Migration);Unknown Population Density (Historical Data Migration);NULL;Level I;Standard Review;No;NULL;Station/Facility, Compression, Pipe;NULL;;NULL;NULL;NULL;NULL;NULL;NULL;NULL;NULL;NULL;NULL;NULL;NULL;NULL;NULL;NULL;NULL;NULL;NULL;NULL;NULL;NULL;NULL;NULL;NULL;No;Rebuilt;5/22/2009;No;NULL;NULL;No;No;5/22/2009;Repair;No
INC2009-047;Fire;5/24/2009;Chetwynd;British Columbia;Westcoast Energy Inc., carrying on business as Spectra Energy Transmission;Closed;55.56925;-121.94485;Not Applicable;Not Applicable;Not Applicable;No;2009;2009/05/24 10:00:00 AM Mountain;2009/05/24 10:00:00 AM Mountain;"Damage or deterioration mechanism, Equipment;Damage or deterioration mechanism, Other Causes, Control System Malfunction";Equipment Failure;"Job or system factors, Excessive wear and tear, Inadequate inspection and/or monitoring;Job or system factors, Inadequate maintenance, Inadequate reparative, Part substitution";Maintenance;NULL;NULL;Operation;NULL;10/5/2012;Yes;No;Fire;NULL;NULL;NULL;No;NULL;Equipment & Electrical;NULL;NULL;NULL;NULL;NULL;NULL;NULL;NULL;0;PPR;WEI - Pine River Gas Plant;NULL;NULL;NULL;NULL;NULL;NULL;NULL;Canada;No;No;No;No;Unknown Land Use (Historical Data Migration);Unknown Population Density (Historical Data Migration);NULL;Level I;Standard Review;No;NULL;Processing Plant, Sulphur plant;NULL;;NULL;NULL;NULL;NULL;NULL;NULL;NULL;NULL;NULL;NULL;NULL;NULL;NULL;NULL;NULL;NULL;NULL;NULL;NULL;NULL;NULL;NULL;NULL;NULL;No;NULL;NULL;No;NULL;NULL;No;No;NULL;NULL;No
INC2009-048;Release of Substance;5/27/2009;Wandering River;Alberta;NOVA Gas Transmission Ltd.;Closed;55.67738;-112.18288;Not Provided;Natural Gas - Sweet;Gas;No;2009;2009/05/25 04:30:00 AM Mountain;2009/05/25 12:00:00 AM Mountain;Damage or deterioration mechanism, Material or Manufacturing, Defective Pipe or Component Body;Defect and Deterioration;Job or system factors, Inadequate maintenance, Inadequate preventive, Assessment of needs;Maintenance;NULL;NULL;Operation;Employee / Contractor (Onsite);7/23/2012;Yes;No;Release of Substance;Natural Gas - Sweet;0;No;No;NULL;NULL;NULL;NULL;NULL;NULL;NULL;NULL;NULL;NULL;0;OPR;NGTL - North Duncan Meter Station;NULL;NULL;NULL;NULL;NULL;NULL;NULL;Canada;Yes;No;No;No;Unknown Land Use (Historical Data Migration);Unknown Population Density (Historical Data Migration);NULL;Level I;Standard Review;No;NULL;Station/Facility, Metering, Delivering, Valve, Pressure relief, Bonnet;NULL;;NULL;NULL;NULL;NULL;NULL;NULL;NULL;NULL;NULL;NULL;NULL;NULL;NULL;NULL;NULL;NULL;NULL;NULL;NULL;NULL;NULL;NULL;NULL;NULL;No;Replacement;NULL;No;NULL;NULL;No;No;NULL;Replacement;No
INC2009-049;Release of Substance;6/3/2009;Vegreville;Alberta;NOVA Gas Transmission Ltd.;Closed;53.63705;-112.01829;Not Provided;Natural Gas - Sweet;Gas;No;2009;2009/06/02 12:00:00 PM Eastern;2009/06/02 12:00:00 PM Eastern;Damage or deterioration mechanism, Cracking, Fatigue;Corrosion and Cracking;Job or system factors, Inadequate work standards, Inadequate development of standards, Procedures or practices or rules;Standards and Procedures;NULL;NULL;Operation;Employee / Contractor (Onsite);7/23/2012;Yes;No;Release of Substance;Natural Gas - Sweet;0;No;No;NULL;NULL;NULL;NULL;NULL;NULL;NULL;NULL;NULL;NULL;0;OPR;NGTL - Ben's Lake Compressor Station;NULL;NULL;NULL;NULL;NULL;NULL;NULL;Canada;Yes;No;No;No;Unknown Land Use (Historical Data Migration);Unknown Population Density (Historical Data Migration);NULL;Level I;Standard Review;No;NULL;Station/Facility, Compression, Pipe;NULL;NPS 3/8;Stainless Steel;NULL;NULL;NULL;NULL;NULL;0;NULL;NULL;NULL;NULL;NULL;NULL;NULL;NULL;NULL;NULL;NULL;NULL;NULL;NULL;NULL;NULL;NULL;No;Replacement;NULL;No;NULL;NULL;No;No;NULL;Replacement;No
INC2009-053;Release of Substance;6/22/2009;Loreburn;Saskatchewan;Alliance Pipeline Ltd.;Closed;51.2719;-106.75421;Not Provided;Natural Gas - Sweet;Gas;No;2009;2009/06/19 09:15:00 AM Mountain;2009/06/19 09:15:00 AM Mountain;Damage or deterioration mechanism, Cracking, Corrosion Fatigue;Corrosion and Cracking;Job or system factors, Inadequate maintenance, Inadequate preventive, Assessment of needs;Maintenance;NULL;NULL;Operation;Employee / Contractor (Onsite);7/27/2012;Yes;No;Release of Substance;Natural Gas - Sweet;0;No;No;NULL;NULL;NULL;NULL;NULL;NULL;NULL;NULL;NULL;NULL;0;OPR;Alliance - Loreburn Mainline Compressor Station;NULL;NULL;NULL;NULL;NULL;NULL;NULL;Canada;Yes;No;No;No;Unknown Land Use (Historical Data Migration);Unknown Population Density (Historical Data Migration);NULL;Level I;Standard Review;No;NULL;Station/Facility, Compression, Fitting, Nipple, Weld;NULL;NPS 1/2;NULL;NULL;NULL;NULL;NULL;NULL;0;NULL;NULL;NULL;NULL;NULL;NULL;NULL;NULL;NULL;NULL;NULL;NULL;NULL;NULL;NULL;NULL;NULL;No;Rebuilt;6/20/2009;No;NULL;NULL;No;No;6/20/2009;Repair;No
INC2009-054;Release of Substance;6/28/2009;Falcon Lake;Manitoba;TransCanada PipeLines Limited;Closed;49.68123;-95.37458;Not Provided;Natural Gas - Sweet;Gas;No;2009;2009/06/28 12:35:00 PM Mountain;2009/06/28 12:35:00 PM Mountain;Damage or deterioration mechanism, Structural Degradation, Overheating;Defect and Deterioration;Job or system factors, Excessive wear and tear, Inadequate maintenance;Maintenance;NULL;NULL;Operation;Employee / Contractor (Onsite);7/27/2012;Yes;No;Release of Substance;Natural Gas - Sweet;0;No;No;NULL;NULL;NULL;NULL;NULL;NULL;NULL;NULL;NULL;NULL;0;OPR;TCPL - Station 45 (Falcon Lake Compressor Station);NULL;NULL;NULL;NULL;NULL;NULL;NULL;Canada;Yes;No;No;No;Unknown Land Use (Historical Data Migration);Unknown Population Density (Historical Data Migration);Mainline Valve + Offset (km);Level I;Standard Review;No;NULL;"Pipeline, Pipe, Body;Station/Facility, Compression, Auxiliary device(s) (please explain)";NULL;NPS 3;NULL;NULL;NULL;NULL;NULL;NULL;0;NULL;NULL;NULL;NULL;NULL;NULL;NULL;NULL;NULL;NULL;NULL;NULL;NULL;NULL;NULL;NULL;NULL;No;Replacement;NULL;No;NULL;NULL;No;No;NULL;Replacement;No
INC2009-055;Release of Substance;6/29/2009;Colborne;Ontario;Enbridge Pipelines Inc.;Closed;44.06958;-77.92945;1.8;Crude Oil - Sweet;Liquid;No;2009;2009/06/29 09:00:00 AM Eastern;2009/06/29 09:00:00 AM Eastern;Damage or deterioration mechanism, Equipment, Valve Seals or Packing;Equipment Failure;Job or system factors, Inadequate maintenance, Inadequate preventive, Assessment of needs;Maintenance;NULL;NULL;Operation;Employee / Contractor (Onsite);7/27/2012;Yes;No;Release of Substance;Crude Oil - Sweet;1.8;No;No;NULL;NULL;NULL;NULL;NULL;NULL;NULL;NULL;NULL;NULL;0;OPR;Line 9;762;850.0346951;Crude Oil;NULL;NULL;NULL;NULL;Canada;Yes;No;No;No;Unknown Land Use (Historical Data Migration);Unknown Population Density (Historical Data Migration);NULL;Level I;Standard Review;No;NULL;Station/Facility, Pumping, Valve;NULL;;NULL;NULL;NULL;NULL;NULL;NULL;NULL;NULL;NULL;NULL;NULL;NULL;NULL;NULL;NULL;NULL;NULL;NULL;NULL;NULL;NULL;NULL;NULL;NULL;No;Replacement;6/29/2009;No;NULL;NULL;No;No;6/29/2009;Replacement;No
INC2009-056;Release of Substance;7/1/2009;Kobes;British Columbia;Westcoast Energy Inc., carrying on business as Spectra Energy Transmission;Closed;56.4929924;-121.335434;Not Provided;Natural Gas - Sour;Gas;No;2009;2009/06/27 08:30:00 PM Pacific;2009/06/27 08:30:00 PM Pacific;Damage or deterioration mechanism, Cracking, Corrosion Fatigue;Corrosion and Cracking;"Personal factors, Lack of knowledge, Lack of experience;Job or system factors, Excessive wear and tear, Inadequate inspection and/or monitoring;Job or system factors, Excessive wear and tear, Improper loading or rate of use";Human Factors, Maintenance;NULL;NULL;Operation;Employee / Contractor (Onsite);10/4/2012;Yes;No;Release of Substance;Natural Gas - Sour;0;No;No;NULL;NULL;NULL;NULL;NULL;NULL;NULL;NULL;NULL;NULL;0;OPR;NULL;NULL;NULL;NULL;NULL;NULL;NULL;NULL;Canada;Yes;No;No;No;Unknown Land Use (Historical Data Migration);Unknown Population Density (Historical Data Migration);NULL;Level I;Standard Review;No;NULL;Station/Facility, Compression, Fitting;NULL;;NULL;NULL;NULL;NULL;NULL;NULL;0;NULL;NULL;NULL;NULL;NULL;NULL;NULL;NULL;NULL;NULL;NULL;NULL;NULL;NULL;NULL;NULL;NULL;No;NULL;NULL;No;NULL;NULL;No;No;NULL;NULL;No
INC2009-057;Operation Beyond Design Limits;7/2/2009;Saint-Eustache;Quebec;Trans-Northern Pipelines Inc.;Closed;45.55865;-73.89602;Not Applicable;Not Applicable;Not Applicable;No;2009;2009/07/01 06:45:00 PM Eastern;2009/07/01 06:50:00 PM Eastern;"Damage or deterioration mechanism, Equipment, Valve Seals or Packing;Damage or deterioration mechanism, Other Causes, Control System Malfunction";Equipment Failure;"Job or system factors, Inadequate engineering, Inadequate standards, specifications and/or design criteria;Job or system factors, Inadequate work standards, Inadequate maintenance of standards, Monitoring use of procedures or practices or rules";Engineering and Planning, Standards and Procedures;NULL;NULL;Operation;Employee / Contractor (Onsite);12/19/2013;Yes;No;Operation Beyond Design Limits;NULL;NULL;NULL;No;NULL;NULL;NULL;NULL;NULL;NULL;NULL;NULL;Over Pressure;NULL;0;OPR;Mainline;273.1;635.0188165;Refined Products-Aviation;NULL;NULL;NULL;NULL;Canada;Yes;No;No;No;Unknown Land Use (Historical Data Migration);Unknown Population Density (Historical Data Migration);Mile Post 29;Level I;Standard Review;No;NULL;"Station/Facility, Pumping, Pump;Station/Facility, Pumping, Instrumentation and controls;Station/Facility, Pumping, Valve, Ball, Other (please explain)";NULL;;NULL;NULL;NULL;NULL;NULL;NULL;NULL;NULL;NULL;NULL;NULL;NULL;NULL;NULL;NULL;NULL;NULL;NULL;NULL;NULL;NULL;NULL;NULL;NULL;No;NULL;NULL;No;NULL;NULL;No;No;NULL;NULL;No
INC2009-058;Fire, Release of Substance;7/5/2009;Hanna;Alberta;NOVA Gas Transmission Ltd.;Closed;51.728528;-111.6805;17000;Natural Gas - Sweet;Gas;Yes;2009;2009/07/04 09:04:00 PM Mountain;2009/07/04 09:04:00 PM Mountain;Substandard Conditions, Weather Related, Lightning;External Interference;Job or system factors, Inadequate maintenance, Inadequate preventive, Assessment of needs;Maintenance;NULL;Transmission;Operation;Employee / Contractor (Onsite);7/30/2012;Yes;No;Fire, Release of Substance;Natural Gas - Sweet;17000;No;No;NULL;Under Investigation or Unknown;NULL;NULL;NULL;NULL;NULL;NULL;NULL;NULL;0;OPR;NULL;NULL;NULL;NULL;NULL;NULL;NULL;NULL;Canada;No;No;Yes;No;Unknown Land Use (Historical Data Migration);Unknown Population Density (Historical Data Migration);NULL;Level III;Category C;Yes;NULL;Pipeline, Pipe, Body;NULL;NPS 6;NULL;NULL;NULL;NULL;NULL;NULL;0;NULL;NULL;NULL;NULL;NULL;NULL;NULL;NULL;NULL;NULL;NULL;NULL;NULL;NULL;NULL;NULL;NULL;No;Replacement;7/9/2009;No;NULL;NULL;No;No;7/9/2009;Replacement;No
INC2009-060;Release of Substance;7/13/2009;Fort Nelson;British Columbia;Westcoast Energy Inc., carrying on business as Spectra Energy Transmission;Closed;58.93456;-121.3121;4;Natural Gas - Sour;Gas;No;2009;2009/07/13 12:00:00 AM Mountain;2009/07/13 04:00:00 PM Pacific;Damage or deterioration mechanism, Material Loss, Internal Material Loss;Corrosion and Cracking;Job or system factors, Inadequate engineering, Inadequate standards, specifications and/or design criteria;Engineering and Planning;NULL;NULL;Operation;Employee / Contractor (Onsite);7/17/2012;Yes;No;Release of Substance;Natural Gas - Sour;4;No;No;NULL;NULL;NULL;NULL;NULL;NULL;NULL;NULL;NULL;NULL;0;OPR;NULL;NULL;NULL;NULL;NULL;NULL;NULL;NULL;Canada;Yes;Yes;No;No;Unknown Land Use (Historical Data Migration);Unknown Population Density (Historical Data Migration);NULL;Level I;Standard Review;No;NULL;;NULL;;NULL;NULL;NULL;NULL;NULL;NULL;NULL;NULL;NULL;NULL;NULL;NULL;NULL;NULL;NULL;NULL;NULL;NULL;NULL;NULL;NULL;NULL;NULL;NULL;No;NULL;NULL;No;NULL;NULL;No;No;NULL;NULL;No
INC2009-063;Release of Substance;7/15/2009;Smokey Lake;Alberta;NOVA Gas Transmission Ltd.;Closed;54.09552;-112.31043;Not Provided;Natural Gas - Sweet;Gas;No;2009;2009/07/14 12:00:00 AM Mountain;2009/07/14 01:15:00 PM Mountain;Damage or deterioration mechanism, Equipment, Valve Seals or Packing;Equipment Failure;Job or system factors, Inadequate maintenance, Inadequate preventive, Assessment of needs;Maintenance;NULL;NULL;Operation;Employee / Contractor (Onsite);7/30/2012;Yes;No;Release of Substance;Natural Gas - Sweet;0;No;No;NULL;NULL;NULL;NULL;NULL;NULL;NULL;NULL;NULL;NULL;0;OPR;NGTL - Smoky Lake Compressor Station;NULL;NULL;NULL;NULL;NULL;NULL;NULL;Canada;Yes;No;No;No;Unknown Land Use (Historical Data Migration);10 or fewer dwelling units per km;NULL;Level I;Standard Review;No;NULL;Station/Facility, Compression, Valve;NULL;;NULL;NULL;NULL;NULL;NULL;NULL;NULL;NULL;NULL;NULL;NULL;NULL;NULL;NULL;NULL;NULL;NULL;NULL;NULL;NULL;NULL;NULL;NULL;NULL;No;Rebuilt;7/14/2009;No;NULL;NULL;No;No;7/14/2009;Repair;No
INC2009-065;Fire;7/16/2009;Wainwright;Alberta;NOVA Gas Transmission Ltd.;Closed;52.75424;-110.74467;Not Applicable;Not Applicable;Not Applicable;No;2009;2009/07/15 03:20:00 PM Mountain;2009/07/15 03:20:00 PM Mountain;Substandard Conditions, Fire and explosion hazards;External Interference;Job or system factors, Inadequate work standards, Inadequate maintenance of standards, Monitoring use of procedures or practices or rules;Standards and Procedures;NULL;NULL;Operation;Employee / Contractor (Onsite);12/22/2010;No;No;Fire;NULL;NULL;NULL;No;NULL;Under Investigation or Unknown;NULL;NULL;NULL;NULL;NULL;NULL;NULL;NULL;0;OPR;NGTL - Wainwright Compressor Station;NULL;NULL;NULL;NULL;NULL;NULL;NULL;Canada;Yes;No;No;No;Unknown Land Use (Historical Data Migration);10 or fewer dwelling units per km;NULL;Level I;Standard Review;No;NULL;;NULL;;NULL;NULL;NULL;NULL;NULL;NULL;NULL;NULL;NULL;NULL;NULL;NULL;NULL;NULL;NULL;NULL;NULL;NULL;NULL;NULL;NULL;NULL;NULL;NULL;No;NULL;NULL;No;NULL;NULL;No;No;NULL;NULL;No
