"App_Type","Hear_Name","Hear_Number","App_Date_Received","Hear_Date_Order","Dec_Date","Cert_Issue_Date","Dur_Days","Env_Assess_Req","Third_Party_Partic","Hear_Days","NEB_Report_Pages","App_Outcome","Reg_Instrum","Reg_Instrum_Type","Conditions_Issued","LTO_Date","Notes","Hear_Corp","Proj_Type","App_Year_Received","Hear_Year_Order","Dec_Year","Cert_Issue_Year","LTO_Year","Dur_Interval","Hear_Interval","Level_Third_Party_Partic","NEB_Report_Length","Start_City","Start_Prov","End_City","End_Prov","postalCodes","zipCodes"
"Large Pipelines","Terasen Pipelines (TransMountain) Inc. - TMX Anchor Loop Project","OH-1-2006",2006-02-17,2006-04-19,2006-10-26,2006-12-05,251,"Yes",24,3,67,"Approved",1,"OH-49",19,2008-03-14,"8 Intervenors, 2 government, 14 letters of comment ( by 5 unique ppl/orgns). Based on a project description filed by Terasen in April 2005, the Board and other Responsible Authorities (RAs) each determined that the Project was subject to a screening level  ssessment under that Act. Since the Project does not require more than 75 km of new RoW, a comprehensive study under the CEA Act was not required.","Terasen","Oil",2006,2006,2006,2006,2008,"Med","3 Days","Small","50-150","Hinton","AB","Rearguard","BC",21,6
"Large Pipelines","SemCAMS Redwillow ULC - Redwillow Pipeline","GH-2-2008",2007-12-07,2008-02-08,2009-03-26,2009-04-27,475,"Yes",12,4,105,"Approved",1,"GC-114",26,NA,"13 intervenors, 1 government, 8 letters of comment. Hearing schedule suspended from March 2008-June 2008 for company to provide required information on traditional land use and environment impacts.  Since the Project requires less than 75 km of newright of way (RoW), a screening level of EA under the CEA Act was required.  Project cancelled by company May 2010. Certificate GC-114 revoked by NEB June 2010 with RO-GC-114","SemCAMS","Gas",2007,2008,2009,2009,NA,"Long","4 Days","Small","50-150","Grande Prairie","AB","Dawson Creek","BC",15,0
"Large Pipelines","Nova Gas Transmission Ltd. - TransCanada Alberta System","GH-5-2008",2008-06-17,2008-07-18,2009-02-26,2009-04-15,254,"Yes",43,10,61,"Approved",1,"GC-113",24,2009-02-26,"38 Intervenors, 5 letters of comment. Hearing in 2 concurrent streams: i) jurisdiction (3 hearing days), ii) facilities (7 hearing days) - request for Certificate under s.52.  Not a hearing for  construction of new facilities. Leave to Open granted at time of decision.","Nova","Gas",2008,2008,2009,2009,2009,"Med","5-20 Days","Med","50-150",NA,"AB","AB",NA,2,1
"Large Pipelines","Enbridge Pipelines Inc. -  Alberta Clipper Expansion Project","OH-4-2007",2007-05-30,2007-06-28,2008-02-22,2008-05-15,268,"Yes",47,4,82,"Approved",1,"OC-54",21,2009-12-23,"31 Intervenors, 3 Government, 13  Letters of Comment.","Enbridge","Oil",2007,2007,2008,2008,2009,"Med","4 Days","Med","50-150","Hardisty","AB","Gretna","MB",21,11
"Large Pipelines","Enbridge Pipelines Inc.- Line 4 Extension Project","OH-5-2007",2007-06-29,2007-07-31,2008-04-15,2008-06-19,291,"Yes",20,1,40,"Approved",2,"OC-55, X0-E101-05-2008",18,2009-03-04,"14 intervenors, 6 letters of comment. 15 conditions on OC-55, 3 conditions on X0-E101-05-2008. The Project
requires 9.9 kilometres (km) of new right-of-way (RoW), therefore a screening level of
environmental assessment under the CEA Act was required.","Enbridge","Oil",2007,2007,2008,2008,2009,"Med","1 Day","Small","1-50","Edmonton","AB","Hardisty","AB",7,1
